evento_id,evento,evento_exemplo,tipo_evento,local,n_artigos,n_classificados,score_medio,media_sentimento,muito_negativo,negativo,neutro,positivo,muito_positivo,n/a,n_positivas,n_negativas,share_positivo,share_negativo,proporcao_positivas,proporcao_negativas,ambiguidade_baixa,ambiguidade_media,ambiguidade_alta,proporcao_ambiguidade_alta,confianca_evento_media,peso_positivo,peso_negativo,titulos_exemplo
licitacao-cameras-uniformes-policias-rj-2021,licitacao_cameras_uniformes_policias_RJ_2021,licitacao_cameras_uniformes_policias_RJ_2021,licitação,"Rio de Janeiro, RJ",1,1,1.0,1.0,0,0,0,1,0,0,1,0,1.0,0.0,1.0,0.0,0,0,0,0.0,0.95,1,0,RJ realiza licitação para a implantação de câmeras nos uniformes de policiais
licitacao-viaturas-seguranca-presente-2025,licitacao_viaturas_seguranca_presente_2025,licitacao_viaturas_seguranca_presente_2025,licitação,Rio de Janeiro,1,1,1.0,1.0,0,0,0,1,0,0,1,0,1.0,0.0,1.0,0.0,0,0,0,0.0,0.95,1,0,"Estado lança licitação de até R$ 44,7 milhões para alugar mais de 300 viaturas para Lei Seca e Segurança Presente"
localizacao-igor-costa-reis,localizacao_igor_costa_reis,localizacao_igor_costa_reis,salvamento,"Cinelândia, Centro do Rio de Janeiro",1,1,1.0,1.0,0,0,0,1,0,0,1,0,1.0,0.0,1.0,0.0,0,0,0,0.0,0.95,1,0,Militar desaparecido é encontrado no Centro do Rio
megaoperacao-policial-zona-oeste-rio-2024,megaoperacao_policial_zona_oeste_rio_2024,megaoperacao_policial_zona_oeste_rio_2024,operação policial,zona oeste do Rio de Janeiro,1,1,1.0,1.0,0,0,0,1,0,0,1,0,1.0,0.0,1.0,0.0,0,0,0,0.0,0.95,1,0,Megaoperação policial ocupa 10 favelas em 6 bairros da zona oeste do Rio
meia-maratona-panfletagem-leblon-lapa-2024,meia_maratona_panfletagem_leblon_lapa_2024,meia_maratona_panfletagem_leblon_lapa_2024,panfletagem eleitoral,"Rio de Janeiro, Brasil",1,1,1.0,1.0,0,0,0,1,0,0,1,0,1.0,0.0,1.0,0.0,0,0,0,0.0,0.95,1,0,Marcelo Queiroz realiza Meia-Maratona de panfletagem do Leblon até a Lapa
menor-indice-crimes-niteroi-2021,menor_indice_crimes_niteroi_2021,menor_indice_crimes_niteroi_2021,redução de criminalidade,"Niterói, Brasil",1,1,1.0,1.0,0,0,0,1,0,0,1,0,1.0,0.0,1.0,0.0,0,0,0,0.0,0.95,1,0,Niterói registrou em dezembro de 2021 o menor índice de crimes na cidade em 18 anos
mobilizacao-carnaval-sapucai-2025,mobilizacao_carnaval_sapucai_2025,mobilizacao_carnaval_sapucai_2025,mobilização policial,"Marquês de Sapucaí, Rio de Janeiro",1,1,1.0,1.0,0,0,0,1,0,0,1,0,1.0,0.0,1.0,0.0,0,0,0,0.0,0.95,1,0,Governo do RJ mobiliza mais de 12 mil policiais e tecnologia de ponta para segurança no Carnaval
mobilizacao-policiais-eleicoes-rj-2020,mobilizacao_policiais_eleicoes_RJ_2020,mobilizacao_policiais_eleicoes_RJ_2020,mobilização policial,"Rio de Janeiro, São Gonçalo, São João de Meriti, Petrópolis e Campos dos Goytacazes",1,1,1.0,1.0,0,0,0,1,0,0,1,0,1.0,0.0,1.0,0.0,0,0,0,0.0,0.95,1,0,Quinze mil policiais vão trabalhar na segurança das eleições no RJ
mobilizacao-seguranca-eleicoes-rj-2024,mobilizacao_seguranca_eleicoes_rj_2024,mobilizacao_seguranca_eleicoes_rj_2024,mobilização de segurança,Rio de Janeiro,1,1,1.0,1.0,0,0,0,1,0,0,1,0,1.0,0.0,1.0,0.0,0,0,0,0.0,0.95,1,0,Mais de 25 mil agentes irão atuar na segurança durante as eleições
niteroi-presente-prisoes-2020,niteroi_presente_prisoes_2020,niteroi_presente_prisoes_2020,prisão,"Niterói, RJ",1,1,1.0,1.0,0,0,0,1,0,0,1,0,1.0,0.0,1.0,0.0,0,0,0,0.0,0.95,1,0,"Às vésperas de completar 3 anos, Niterói Presente ultrapassa uma centena de prisões em flagrante - Prefeitura Municipal de Niterói"
niteroi-sem-homicidios-agosto-2025,niteroi_sem_homicidios_agosto_2025,niteroi_sem_homicidios_agosto_2025,registro de segurança,"Niterói, RJ",1,1,1.0,1.0,0,0,0,1,0,0,1,0,1.0,0.0,1.0,0.0,0,0,0,0.0,0.95,1,0,"Vizinha do Rio, Niterói registra mês histórico sem vítimas de homicídio"
operacao-aterro-flamengo-2026,Operacao_Aterro_Flamengo_2026,Operacao_Aterro_Flamengo_2026,Operação policial,"Aterro do Flamengo, Rio de Janeiro",1,1,1.0,1.0,0,0,0,1,0,0,1,0,1.0,0.0,1.0,0.0,0,0,0,0.0,0.95,1,0,Operação no Aterro do Flamengo leva 10 flanelinhas à delegacia por cobrança irregular a motoristas
operacao-carnaval-2025,operacao_carnaval_2025,operacao_carnaval_2025,Operação de segurança,Rio de Janeiro,1,1,1.0,1.0,0,0,0,1,0,0,1,0,1.0,0.0,1.0,0.0,0,0,0,0.0,0.95,1,0,Carnaval do Rio de Janeiro 2025: Segurança reforçada e serviços aprimorados para garantir a festa dos foliões
operacao-carnaval-2026,operacao_carnaval_2026,operacao_carnaval_2026,operação de segurança,Rio de Janeiro,1,1,1.0,1.0,0,0,0,1,0,0,1,0,1.0,0.0,1.0,0.0,0,0,0,0.0,0.95,1,0,"Governo do estado monta operação de Carnaval com 26 mil agentes de segurança, drones e reconhecimento facial"
operacao-choque-ordem-presente-gavea-lagoa-2026,operacao_choque_ordem_presente_gavea_lagoa_2026,operacao_choque_ordem_presente_gavea_lagoa_2026,Operação de segurança,"Gávea e Lagoa Rodrigo de Freitas, Rio de Janeiro",1,1,1.0,1.0,0,0,0,1,0,0,1,0,1.0,0.0,1.0,0.0,0,0,0,0.0,0.95,1,0,Choque de Ordem Presente intensifica ações de segurança na Gávea e no entorno da Lagoa
operacao-combate-crack-copacabana-2022,operacao_combate_crack_copacabana_2022,operacao_combate_crack_copacabana_2022,Operação policial,"Copacabana, Rio de Janeiro",1,1,1.0,1.0,0,0,0,1,0,0,1,0,1.0,0.0,1.0,0.0,0,0,0,0.0,,1,0,Copacabana recebe operação de combate ao consumo de crack e delitos praticados por marginais
operacao-combate-delitos-copacabana-2023,Operacao_combate_delitos_Copacabana_2023,Operacao_combate_delitos_Copacabana_2023,Operação policial,"Copacabana, Rio de Janeiro",1,1,1.0,1.0,0,0,0,1,0,0,1,0,1.0,0.0,1.0,0.0,0,0,0,0.0,,1,0,Operação de combate a delitos aborda 31 pessoas e apreende armas brancas em Copacabana
operacao-cracolandia-catete-2024,operacao_cracolandia_catete_2024,operacao_cracolandia_catete_2024,Operação policial,"Catete, Rio de Janeiro",1,1,1.0,1.0,0,0,0,1,0,0,1,0,1.0,0.0,1.0,0.0,0,0,0,0.0,0.95,1,0,Operação nesta sexta estoura cracolândia no Catete
operacao-cracolandia-jardim-de-alah-2022,operacao_cracolandia_jardim_de_alah_2022,operacao_cracolandia_jardim_de_alah_2022,operação policial,"Jardim de Alah, entre Ipanema e Leblon, Rio de Janeiro",1,1,1.0,1.0,0,0,0,1,0,0,1,0,1.0,0.0,1.0,0.0,0,0,0,0.0,0.95,1,0,"Polícia estoura grande cracolândia no Jardim de Alah, entre Ipanema e Leblon"
operacao-desmancha-cracolandia-gloria-2023,operacao_desmancha_cracolandia_gloria_2023,operacao_desmancha_cracolandia_gloria_2023,Operação policial,"Glória, Rio de Janeiro",1,1,1.0,1.0,0,0,0,1,0,0,1,0,1.0,0.0,1.0,0.0,0,0,0,0.0,,1,0,Operação desmancha cracolândia na Glória
operacao-fiscalizacao-galeao-2024,operacao_fiscalizacao_galeao_2024,operacao_fiscalizacao_galeao_2024,Operação de fiscalização,"Aeroporto Internacional Tom Jobim — Galeão, Rio de Janeiro",1,1,1.0,1.0,0,0,0,1,0,0,1,0,1.0,0.0,1.0,0.0,0,0,0,0.0,0.95,1,0,"Taxistas piratas, tremei: hoje tem mega operação no Galeão"
operacao-fiscalizacao-motos-niteroi-2026,operacao_fiscalizacao_motos_niteroi_2026,operacao_fiscalizacao_motos_niteroi_2026,Fiscalização,"Rua Martins Torres, Santa Rosa, Niterói",1,1,1.0,1.0,0,0,0,1,0,0,1,0,1.0,0.0,1.0,0.0,0,0,0,0.0,0.95,1,0,Vídeo: motos barulhentas viram alvo e Prefeitura de Niterói faz primeira grande operação de 2026
operacao-guia-turistico-cristo-redentor-2022,operacao_guia_turistico_cristo_redentor_2022,operacao_guia_turistico_cristo_redentor_2022,Operação policial,"Cristo Redentor, Rio de Janeiro",1,1,1.0,1.0,0,0,0,1,0,0,1,0,1.0,0.0,1.0,0.0,0,0,0,0.0,,1,0,Operação para reprimir irregularidades com turistas no Cristo Redentor encaminha 14 guias ilegais à delegacia
operacao-integrada-crimes-rua-flamengo-gloria-2023,operacao_integrada_crimes_rua_flamengo_gloria_2023,operacao_integrada_crimes_rua_flamengo_gloria_2023,operação policial,"Aterro do Flamengo e Glória, Rio de Janeiro",1,1,1.0,1.0,0,0,0,1,0,0,1,0,1.0,0.0,1.0,0.0,0,0,0,0.0,0.95,1,0,Aterro do Flamengo e Glória recebem operação contra crimes de rua
operacao-lei-seca-carnaval-2026,operacao_lei_seca_carnaval_2026,operacao_lei_seca_carnaval_2026,blitz,Rio de Janeiro,1,1,1.0,1.0,0,0,0,1,0,0,1,0,1.0,0.0,1.0,0.0,0,0,0,0.0,0.95,1,0,Lei Seca terá 50 blitzes no carnaval e vai fiscalizar motoristas de carros alegóricos
operacao-lei-seca-carnaval-rio-2026,operacao_lei_seca_carnaval_rio_2026,operacao_lei_seca_carnaval_rio_2026,Operação de segurança,Rio de Janeiro,1,1,1.0,1.0,0,0,0,1,0,0,1,0,1.0,0.0,1.0,0.0,0,0,0,0.0,0.95,1,0,Como vai funcionar a Lei Seca durante o Carnaval no Rio
operacao-lei-seca-rock-in-rio-2024,Operacao_Lei_Seca_Rock_in_Rio_2024,Operacao_Lei_Seca_Rock_in_Rio_2024,prisão,"Cidade do Rock, Rio de Janeiro",1,1,1.0,1.0,0,0,0,1,0,0,1,0,1.0,0.0,1.0,0.0,0,0,0,0.0,0.95,1,0,Lei Seca flagra 139 motoristas alcoolizados na primeira noite do Rock in Rio
operacao-motos-barulhentas-sao-goncalo-2025,operacao_motos_barulhentas_sao_goncalo_2025,operacao_motos_barulhentas_sao_goncalo_2025,operação,"Neves e Porto Velho, São Gonçalo",1,1,1.0,1.0,0,0,0,1,0,0,1,0,1.0,0.0,1.0,0.0,0,0,0,0.0,0.95,1,0,Prefeitura de São Gonçalo intensifica combate a motos barulhentas nas ruas
operacao-mulher-presente-atendimentos,operacao_mulher_presente_atendimentos,operacao_mulher_presente_atendimentos,atendimento,"Praça Saens Peña, Tijuca, Rio de Janeiro",1,1,1.0,1.0,0,0,0,1,0,0,1,0,1.0,0.0,1.0,0.0,0,0,0,0.0,0.95,1,0,"Em apenas 4 meses de atuação, Operação Mulher Presente faz 471 atendimentos"
operacao-ordo-prende-21-pessoas,Operacao_Ordo_prende_21_pessoas,Operacao_Ordo_prende_21_pessoas,prisão,"Barra/Jacarepaguá, Rio de Janeiro",1,1,1.0,1.0,0,0,0,1,0,0,1,0,1.0,0.0,1.0,0.0,0,0,0,0.0,,1,0,Operação Ordo prende 21 pessoas nas primeiras horas
operacao-ordo-prisoes-barricadas-2024,operacao_ordo_prisoes_barricadas_2024,operacao_ordo_prisoes_barricadas_2024,prisão,Zona Oeste do Rio de Janeiro,1,1,1.0,1.0,0,0,0,1,0,0,1,0,1.0,0.0,1.0,0.0,0,0,0,0.0,0.95,1,0,Operação Ordo já conta com 45 prisões e 22 toneladas em barricadas removidas
operacao-ordo-rio-2024,Operacao_Ordo_Rio_2024,Operacao_Ordo_Rio_2024,operação policial,"Jacarepaguá, Barra da Tijuca, Recreio e Vargens, Rio de Janeiro",1,1,1.0,1.0,0,0,0,1,0,0,1,0,1.0,0.0,1.0,0.0,0,0,0,0.0,0.95,1,0,"Polícia do Rio ocupa comunidades em e Jacarepaguá, Barra da Tijuca, Recreio e Vargens – Ação será permanente"
operacao-porto-seguro,operacao_porto_seguro,operacao_porto_seguro,inauguracao,Rio de Janeiro,1,1,1.0,1.0,0,0,0,1,0,0,1,0,1.0,0.0,1.0,0.0,0,0,0,0.0,0.95,1,0,Governo do RJ implementa operação para reforçar fiscalização nos portos do estado
operacao-reveillon-rio-2025,operacao_reveillon_rio_2025,operacao_reveillon_rio_2025,Operação de segurança,"Rio de Janeiro, Copacabana",1,1,1.0,1.0,0,0,0,1,0,0,1,0,1.0,0.0,1.0,0.0,0,0,0,0.0,0.95,1,0,"Réveillon no Rio terá 28,7 mil policiais e reconhecimento facial"
operacao-seguranca-carnaval-2024,operacao_seguranca_carnaval_2024,operacao_seguranca_carnaval_2024,Operação de segurança,"Marquês de Sapucaí, Rio de Janeiro",1,1,1.0,1.0,0,0,0,1,0,0,1,0,1.0,0.0,1.0,0.0,0,0,0,0.0,0.95,1,0,Governo do RJ garante segurança e tranquilidade nos ensaios técnicos na Marquês de Sapucaí
operacao-seguranca-catete-flamengo-2023,operacao_seguranca_catete_flamengo_2023,operacao_seguranca_catete_flamengo_2023,operação de segurança,"Catete e Flamengo, Rio de Janeiro",1,1,1.0,1.0,0,0,0,1,0,0,1,0,1.0,0.0,1.0,0.0,0,0,0,0.0,0.95,1,0,Catete e Flamengo recebem operação de segurança integrada para combate às drogas
operacao-seguranca-presente-atendimentos-2022,operacao_seguranca_presente_atendimentos_2022,operacao_seguranca_presente_atendimentos_2022,atendimento assistencial,Rio de Janeiro,1,1,1.0,1.0,0,0,0,1,0,0,1,0,1.0,0.0,1.0,0.0,0,0,0,0.0,0.95,1,0,Operação Segurança Presente já solucionou quase 300 desaparecimentos e fez mais de 200 mil atendimentos assistenciais
operacao-seguranca-presente-campos,operacao_seguranca_presente_campos,operacao_seguranca_presente_campos,prisão,"Campos dos Goytacazes, Rio de Janeiro",1,1,1.0,1.0,0,0,0,1,0,0,1,0,1.0,0.0,1.0,0.0,0,0,0,0.0,0.95,1,0,Segurança Presente de Campos levou 38 suspeitos à delegacia na primeira semana de atuação
operacao-seguranca-presente-pm-am-2026,operacao_seguranca_presente_pm_am_2026,operacao_seguranca_presente_pm_am_2026,prisão,"Manaus, Amazonas",1,1,1.0,1.0,0,0,0,1,0,0,1,0,1.0,0.0,1.0,0.0,0,0,0,0.0,0.95,1,0,"Operação Segurança Presente: Em três dias, PMAM prende cerca de 40 pessoas em todas as zonas da capital - SSP-AM"
operacao-seguranca-presente-visibilidade-policial,operacao_seguranca_presente_visibilidade_policial,operacao_seguranca_presente_visibilidade_policial,operação policial,"Manaus, Amazonas",1,1,1.0,1.0,0,0,0,1,0,0,1,0,1.0,0.0,1.0,0.0,0,0,0,0.0,0.95,1,0,SSP-AM reforça a Operação Segurança Presente com foco em visibilidade policial - SSP-AM
operacao-verao-2025-niteroi,operacao_verao_2025_niteroi,operacao_verao_2025_niteroi,Operação de segurança,"Niterói, Brasil",1,1,1.0,1.0,0,0,0,1,0,0,1,0,1.0,0.0,1.0,0.0,0,0,0,0.0,0.95,1,0,Operação Verão em Niterói começa no sábado com 350 agentes nas ruas
padrinho-seguranca-presente-rodrigo-amorim,padrinho_segurança_presente_rodrigo_amorim,padrinho_segurança_presente_rodrigo_amorim,apoio político,Rio de Janeiro,1,1,1.0,1.0,0,0,0,1,0,0,1,0,1.0,0.0,1.0,0.0,0,0,0,0.0,0.9,1,0,Candidatos a deputado de Jair Bolsonaro no Rio de Janeiro
parceria-guarda-municipal-seguranca-presente,parceria_guarda_municipal_seguranca_presente,parceria_guarda_municipal_seguranca_presente,proposta política,"Praça Saens Peña, Tijuca, Rio de Janeiro",1,1,1.0,1.0,0,0,0,1,0,0,1,0,1.0,0.0,1.0,0.0,0,0,0,0.0,0.95,1,0,Luiz Lima quer Guarda Municipal atuando em parceria com programa Segurança Presente
patrulhamento-seguranca-presente-galeao-2024,patrulhamento_segurança_presente_galeão_2024,patrulhamento_segurança_presente_galeão_2024,anuncio de segurança,"Aeroporto Internacional Tom Jobim (RIOgaleão), Ilha do Governador, Rio de Janeiro",1,1,1.0,1.0,0,0,0,1,0,0,1,0,1.0,0.0,1.0,0.0,0,0,0,0.0,0.95,1,0,"Depois do Carnaval, Galeão contará com patrulhamento do Segurança Presente"
perimetro-tolerancia-zero-rio-2025,perimetro_tolerancia_zero_rio_2025,perimetro_tolerancia_zero_rio_2025,iniciativa,Rio de Janeiro,1,1,1.0,1.0,0,0,0,1,0,0,1,0,1.0,0.0,1.0,0.0,0,0,0,0.0,0.9,1,0,‘Rio Vamos Vencer’ celebra avanços e define prioridades para área de turismo em 2025
perseguicao-assaltante-fernando-armelau-estacio-2025,perseguicao_assaltante_fernando_armelau_estacio_2025,perseguicao_assaltante_fernando_armelau_estacio_2025,perseguição,"Estácio, Rio de Janeiro",1,1,1.0,1.0,0,0,0,1,0,0,1,0,1.0,0.0,1.0,0.0,0,0,0,0.0,0.95,1,0,Vereador Fernando Armelau persegue assaltante e recupera celulares no Estácio
plantacao-maconha-niteroi-2026,plantacao_maconha_niteroi_2026,plantacao_maconha_niteroi_2026,apreensao,"Região Oceânica de Niterói, Estrada do Muriqui Pequeno, Vila Progresso",1,1,1.0,1.0,0,0,0,1,0,0,1,0,1.0,0.0,1.0,0.0,0,0,0,0.0,0.95,1,0,Plantação com 125 pés de maconha é descoberta em Niterói
pontos-hidratacao-pets-rio-2025,pontos_hidratacao_pets_rio_2025,pontos_hidratacao_pets_rio_2025,inauguracao,Rio de Janeiro,1,1,1.0,1.0,0,0,0,1,0,0,1,0,1.0,0.0,1.0,0.0,0,0,0,0.0,0.95,1,0,Rio terá pontos de hidratação para pets durante o calor intenso
posse-conselho-renovacao-centro-rio-2024,posse_conselho_renovacao_centro_rio_2024,posse_conselho_renovacao_centro_rio_2024,posse,Centro do Rio de Janeiro,1,1,1.0,1.0,0,0,0,1,0,0,1,0,1.0,0.0,1.0,0.0,0,0,0,0.0,0.95,1,0,Conselho de Renovação do Centro do Rio anuncia novos líderes e traça futuro promissor para a região
posse-conselhos-seguranca-barra-mansa-2026,posse_conselhos_seguranca_barra_mansa_2026,posse_conselhos_seguranca_barra_mansa_2026,posse,"Barra Mansa, RJ",1,1,1.0,1.0,0,0,0,1,0,0,1,0,1.0,0.0,1.0,0.0,0,0,0,0.0,0.95,1,0,Posse dos Conselhos de Segurança reúne autoridades e lideranças em Barra Mansa
posse-rodrigo-amorim-comissao-seguranca-publica-2023,posse_rodrigo_amorim_comissao_seguranca_publica_2023,posse_rodrigo_amorim_comissao_seguranca_publica_2023,posse,"Buenos Aires, Argentina",1,1,1.0,1.0,0,0,0,1,0,0,1,0,1.0,0.0,1.0,0.0,0,0,0,0.0,0.95,1,0,Deputado Rodrigo Amorim assume a presidência da Comissão de Segurança Pública da União de Parlamentares Sul-Americanos e do Mercosul
posto-avancado-policia-militar-cinelandia-2022,posto_avancado_policia_militar_cinelândia_2022,posto_avancado_policia_militar_cinelândia_2022,inauguracao,"Cinelândia, Rio de Janeiro",1,1,1.0,1.0,0,0,0,1,0,0,1,0,1.0,0.0,1.0,0.0,0,0,0,0.0,0.95,1,0,Comerciantes do Centro do Rio firmam parceria com a polícia e Cinelândia terá posto da PM
pregao-bicicletas-seguranca-presente-2025,pregao_bicicletas_seguranca_presente_2025,pregao_bicicletas_seguranca_presente_2025,Pregão,Rio de Janeiro,1,1,1.0,1.0,0,0,0,1,0,0,1,0,1.0,0.0,1.0,0.0,0,0,0,0.0,0.95,1,0,Estado abre pregão para compra de 400 bicicletas elétricas para agentes do Segurança Presente
prisa-homem-agressao-namorada-centro-rio-2026,prisa_homem_agressao_namorada_centro_rio_2026,prisa_homem_agressao_namorada_centro_rio_2026,prisão,"Rua dos Andradas, Centro do Rio de Janeiro",1,1,1.0,1.0,0,0,0,1,0,0,1,0,1.0,0.0,1.0,0.0,0,0,0,0.0,,1,0,Homem é preso por agredir namorada e danificar celular no Centro
prisao-abuso-familiar-niteroi-2026,prisao_abuso_familiar_niteroi_2026,prisao_abuso_familiar_niteroi_2026,prisão,"Niterói, RJ",1,1,1.0,1.0,0,0,0,1,0,0,1,0,1.0,0.0,1.0,0.0,0,0,0,0.0,0.95,1,0,Pai acusado de abusar da própria filha é preso em Niterói
prisao-ambulante-aterro-flamengo-2025,prisao_ambulante_aterro_flamengo_2025,prisao_ambulante_aterro_flamengo_2025,prisão,"Aterro do Flamengo, Rio de Janeiro",1,1,1.0,1.0,0,0,0,1,0,0,1,0,1.0,0.0,1.0,0.0,0,0,0,0.0,0.95,1,0,Briga entre ambulantes pelo preço do coco termina em facada e prisão no Aterro do Flamengo
prisao-carlos-henrique-nova-iguacu-2026,prisao_carlos_henrique_nova_iguacu_2026,prisao_carlos_henrique_nova_iguacu_2026,prisão,"Nova Iguaçu, Rio de Janeiro",1,1,1.0,1.0,0,0,0,1,0,0,1,0,1.0,0.0,1.0,0.0,0,0,0,0.0,0.95,1,0,Justiça decreta prisão preventiva de homem que agrediu funcionária em tentativa de roubo a sorveteria em Nova Iguaçu
prisao-carnaval-pmerj-2024,prisao_carnaval_pmerj_2024,prisao_carnaval_pmerj_2024,prisão,Rio de Janeiro,1,1,1.0,1.0,0,0,0,1,0,0,1,0,1.0,0.0,1.0,0.0,0,0,0,0.0,0.95,1,0,PMERJ prende mais de 200 pessoas durante o Carnaval
prisao-cartao-jae-rio-2025,prisao_cartao_jae_rio_2025,prisao_cartao_jae_rio_2025,prisão,"Terminal Procópio Ferreira, Centro do Rio de Janeiro",1,1,1.0,1.0,0,0,0,1,0,0,1,0,1.0,0.0,1.0,0.0,0,0,0,0.0,0.95,1,0,Três são presos por uso irregular do cartão Jaé no Centro do Rio
prisao-casal-assalto-motorista-aplicativo-rio,prisao_casal_assalto_motorista_aplicativo_rio,prisao_casal_assalto_motorista_aplicativo_rio,prisão,Centro do Rio de Janeiro,1,1,1.0,1.0,0,0,0,1,0,0,1,0,1.0,0.0,1.0,0.0,0,0,0,0.0,0.95,1,0,Casal é preso após assaltar motorista de aplicativo no Centro do Rio
prisao-corte-arvore-maracana-2023,prisao_corte_arvore_maracana_2023,prisao_corte_arvore_maracana_2023,prisão,"Maracanã, Rio de Janeiro",1,1,1.0,1.0,0,0,0,1,0,0,1,0,1.0,0.0,1.0,0.0,0,0,0,0.0,,1,0,Homens são presos cortando árvore ilegalmente no entorno do Maracanã
prisao-criminosos-assalto-artigiano-ipanema-2025,prisao_criminosos_assalto_artigiano_ipanema_2025,prisao_criminosos_assalto_artigiano_ipanema_2025,prisão,"Ipanema, Rio de Janeiro",1,1,1.0,1.0,0,0,0,1,0,0,1,0,1.0,0.0,1.0,0.0,0,0,0,0.0,0.95,1,0,Restaurante que sofreu tentativa de assalto só aceita dinheiro em espécie
prisao-criminosos-sao-goncalo-2025,prisao_criminosos_sao_goncalo_2025,prisao_criminosos_sao_goncalo_2025,prisão,"São Gonçalo, RJ",1,1,1.0,1.0,0,0,0,1,0,0,1,0,1.0,0.0,1.0,0.0,0,0,0,0.0,0.95,1,0,Segurança Presente prende criminosos e põe fim a ataques em São Gonçalo
prisao-drogas-atalaia-do-norte-2026,prisao_drogas_atalaia_do_norte_2026,prisao_drogas_atalaia_do_norte_2026,prisão,"Atalaia do Norte, Amazonas",1,1,1.0,1.0,0,0,0,1,0,0,1,0,1.0,0.0,1.0,0.0,0,0,0,0.0,,1,0,Segurança Presente: PMAM prende homem com mais de 16 kg de drogas em Atalaia do Norte - SSP-AM
prisao-dupla-celulares-roubados-2026,prisao_dupla_celulares_roubados_2026,prisao_dupla_celulares_roubados_2026,prisão,"Rua Uruguaiana, Centro do Rio de Janeiro",1,1,1.0,1.0,0,0,0,1,0,0,1,0,1.0,0.0,1.0,0.0,0,0,0,0.0,0.95,1,0,Dupla é presa em flagrante com 12 celulares roubados na Uruguaiana
prisao-estupro-niteroi-2025,prisao_estupro_niteroi_2025,prisao_estupro_niteroi_2025,prisão,"Niterói, bairro Caramujo",1,1,1.0,1.0,0,0,0,1,0,0,1,0,1.0,0.0,1.0,0.0,0,0,0,0.0,0.95,1,0,Homem é preso por estupro da própria irmã em Niterói
prisao-ex-pm-niteroi-2025,prisao_ex_pm_niteroi_2025,prisao_ex_pm_niteroi_2025,prisão,"Niterói, RJ",1,1,1.0,1.0,0,0,0,1,0,0,1,0,1.0,0.0,1.0,0.0,0,0,0,0.0,0.95,1,0,Ex-PM é preso em Niterói por tentar matar o próprio irmão com 15 tiros; vídeo
prisao-falso-funcionario-light-copacabana-2026,prisao_falso_funcionario_light_copacabana_2026,prisao_falso_funcionario_light_copacabana_2026,prisão,"Rua Siqueira Campos, Copacabana, Rio de Janeiro",1,1,1.0,1.0,0,0,0,1,0,0,1,0,1.0,0.0,1.0,0.0,0,0,0,0.0,,1,0,Falso funcionário da Light é preso após furto em supermercado de Copacabana
prisao-flanelinha-barra-tijuca-2026,prisao_flanelinha_barra_tijuca_2026,prisao_flanelinha_barra_tijuca_2026,prisão,"Avenida Lúcio Costa, Barra da Tijuca, Rio de Janeiro",1,1,1.0,1.0,0,0,0,1,0,0,1,0,1.0,0.0,1.0,0.0,0,0,0,0.0,,1,0,Vídeo: Flanelinha é presa por ameaçar motorista na Barra
prisao-foragidos-carnaval-2025,prisao_foragidos_carnaval_2025,prisao_foragidos_carnaval_2025,prisão,Rio de Janeiro,1,1,1.0,1.0,0,0,0,1,0,0,1,0,1.0,0.0,1.0,0.0,0,0,0,0.0,0.95,1,0,Reconhecimento facial auxilia na prisão de cinco foragidos durante o Carnaval no Rio
prisao-fraude-notebook-meier-2024,prisao_fraude_notebook_meier_2024,prisao_fraude_notebook_meier_2024,prisão,"Méier, Rio de Janeiro",1,1,1.0,1.0,0,0,0,1,0,0,1,0,1.0,0.0,1.0,0.0,0,0,0,0.0,,1,0,"Mulher é presa em flagrante, no Méier, por receptação fraudulenta de notebook"
prisao-furto-bicicleta-leblon-2026,prisao_furto_bicicleta_leblon_2026,prisao_furto_bicicleta_leblon_2026,prisão,"Avenida Ataulfo de Paiva, Leblon, Rio de Janeiro",1,1,1.0,1.0,0,0,0,1,0,0,1,0,1.0,0.0,1.0,0.0,0,0,0,0.0,,1,0,Homem é preso em flagrante tentando furtar bicicleta com alicate de corte no Leblon
prisao-furto-campos-goytacazes-2025,prisao_furto_campos_goytacazes_2025,prisao_furto_campos_goytacazes_2025,prisão,"Rua dos Goytacazes, Centro, Campos dos Goytacazes",1,1,1.0,1.0,0,0,0,1,0,0,1,0,1.0,0.0,1.0,0.0,0,0,0,0.0,,1,0,Dupla é presa em Campos dos Goytacazes por furto em residência
prisao-furto-carne-nova-iguacu-2023,prisao_furto_carne_nova_iguacu_2023,prisao_furto_carne_nova_iguacu_2023,prisão,"Nova Iguaçu, Baixada Fluminense",1,1,1.0,1.0,0,0,0,1,0,0,1,0,1.0,0.0,1.0,0.0,0,0,0,0.0,0.95,1,0,Mulher é presa após tentar furtar 15kg de carne de supermercado em Nova Iguaçu
prisao-furto-farmacia-barra-tijuca-2025,prisao_furto_farmacia_barra_tijuca_2025,prisao_furto_farmacia_barra_tijuca_2025,prisão,"Rua Olegário Maciel, Barra da Tijuca, Rio de Janeiro",1,1,1.0,1.0,0,0,0,1,0,0,1,0,1.0,0.0,1.0,0.0,0,0,0,0.0,0.95,1,0,PMs prendem três por furto de 227 itens de farmácia na Barra; vídeo
prisao-furto-farmacia-vila-isabel-2025,prisao_furto_farmacia_vila_isabel_2025,prisao_furto_farmacia_vila_isabel_2025,prisão,"Avenida Boulevard 28 de Setembro, Vila Isabel, Zona Norte, Rio de Janeiro",1,1,1.0,1.0,0,0,0,1,0,0,1,0,1.0,0.0,1.0,0.0,0,0,0,0.0,0.95,1,0,Homem é preso e criança apreendida após furto a farmácia em Vila Isabel
prisao-furto-hidrometro-copacabana-2026,prisao_furto_hidrometro_copacabana_2026,prisao_furto_hidrometro_copacabana_2026,prisão,"MetrôRio, Copacabana, Rio de Janeiro",1,1,1.0,1.0,0,0,0,1,0,0,1,0,1.0,0.0,1.0,0.0,0,0,0,0.0,0.95,1,0,Homem é preso por furto de hidrômetro em metrô de Copacabana
prisao-furto-padaria-copacabana-2021,prisao_furto_padaria_copacabana_2021,prisao_furto_padaria_copacabana_2021,prisão,"Copacabana, Rio de Janeiro",1,1,1.0,1.0,0,0,0,1,0,0,1,0,1.0,0.0,1.0,0.0,0,0,0,0.0,,1,0,Homem é preso ao tentar furtar caixinha de Natal de padaria em Copacabana
prisao-furto-turista-flamengo-2025,prisao_furto_turista_flamengo_2025,prisao_furto_turista_flamengo_2025,prisão,"Praia do Flamengo, Rio de Janeiro",1,1,1.0,1.0,0,0,0,1,0,0,1,0,1.0,0.0,1.0,0.0,0,0,0,0.0,,1,0,Vídeo: Homem é preso após engolir cordão furtado de turista no Flamengo
prisao-furtos-escola-niteroi-2025,prisao_furtos_escola_niteroi_2025,prisao_furtos_escola_niteroi_2025,prisão,"Niterói, Rio de Janeiro",1,1,1.0,1.0,0,0,0,1,0,0,1,0,1.0,0.0,1.0,0.0,0,0,0,0.0,,1,0,Homem é preso por invadir escola várias vezes para furtar equipamentos em Niterói
prisao-furtos-niteroi-2026,prisao_furtos_niteroi_2026,prisao_furtos_niteroi_2026,prisão,"Icaraí, Niterói",1,1,1.0,1.0,0,0,0,1,0,0,1,0,1.0,0.0,1.0,0.0,0,0,0,0.0,0.95,1,0,Vídeo: homem é preso por série de furtos em Niterói
prisao-gabriel-silote-oliveira-2023,prisao_gabriel_silote_oliveira_2023,prisao_gabriel_silote_oliveira_2023,prisão,"Igreja da Candelária, Centro do Rio de Janeiro",1,1,1.0,1.0,0,0,0,1,0,0,1,0,1.0,0.0,1.0,0.0,0,0,0,0.0,,1,0,Homem é preso no Centro do Rio após tentar incendiar a Igreja da Candelária
prisao-golpe-caixa-eletronico-sao-goncalo-2025,prisao_golpe_caixa_eletronico_sao_goncalo_2025,prisao_golpe_caixa_eletronico_sao_goncalo_2025,prisão,"São Gonçalo, Região Metropolitana do Rio de Janeiro",1,1,1.0,1.0,0,0,0,1,0,0,1,0,1.0,0.0,1.0,0.0,0,0,0,0.0,0.95,1,0,Fim da linha: PM prende dois por golpe do caixa eletrônico em São Gonçalo
prisao-golpe-pix-nilopolis-2026,prisao_golpe_pix_nilopolis_2026,prisao_golpe_pix_nilopolis_2026,prisão,"Nilópolis, Baixada Fluminense",1,1,1.0,1.0,0,0,0,1,0,0,1,0,1.0,0.0,1.0,0.0,0,0,0,0.0,,1,0,"Mulher é presa por aplicar golpe do falso Pix de R$ 1,5 mil em estabelecimento na Baixada"
