articleId,recordKey,publishedAt,sourceName,sourceHost,title,label,sentiment_score,evento,evento_chave,evento_id,tipo_evento,local,data_evento,descricao_curta,model
1755,a-1755,2026-01-08 17:41:56+00:00,Agenda do Poder,agendadopoder.com.br,Professora morta em tiroteio na Baixada é enterrada sob comoção,muito negativo,-2.0,Morte da professora Silvânia da Silva Guimarães em tiroteio durante assalto em Duque de Caxias,morte-professora-silvania-duque-de-caxias-2026,morte-professora-silvania-duque-de-caxias-2026,violencia/crime,"Duque de Caxias, Baixada Fluminense",2026-01-06,Professora é morta em tiroteio durante assalto em Duque de Caxias.,gpt-4o-mini
1754,a-1754,2026-01-09 21:45:14+00:00,Agenda do Poder,agendadopoder.com.br,Mulher entra em luta corporal com policiais durante abordagem em Japeri,negativo,-1.0,Confronto físico entre mulher e policiais do Segurança Presente em Japeri,confronto-fisico-mulher-policiais-seguranca-presente-japeri-2026,confronto-fisico-mulher-policiais-seguranca-presente-japeri-2026,violencia/crime,Japeri,2026-01-09,Mulher entra em luta corporal com policiais durante abordagem em Japeri.,gpt-4o-mini
1753,a-1753,2026-01-10 17:24:36+00:00,Agenda do Poder,agendadopoder.com.br,Vídeo: motos barulhentas viram alvo e Prefeitura de Niterói faz primeira grande operação de 2026,positivo,1.0,Fiscalização contra motos barulhentas em Niterói,fiscalizacao-motos-barulhentas-niteroi-2026,fiscalizacao-motos-barulhentas-niteroi-2026,operacao policial,Niterói,2026-01-09,Primeira operação de 2026 contra motos barulhentas em Niterói resulta em autuações e remoções.,gpt-4o-mini
1752,a-1752,2026-01-12 11:46:00+00:00,Agenda do Poder,agendadopoder.com.br,Justiça mantém prisão de lutadora que agrediu PMs em Japeri,negativo,-1.0,Manutenção da prisão de lutadora que agrediu PMs em Japeri,manutencao-prisao-lutadora-agrediu-pms-japeri-2026,manutencao-prisao-lutadora-agrediu-pms-japeri-2026,prisao/apreensao,Japeri,2026-01-11,"A Justiça manteve a prisão de Mariana Leal Gomes, que agrediu PMs do Segurança Presente em Japeri.",gpt-4o-mini
1751,a-1751,2026-01-13 11:37:00+00:00,Agenda do Poder,agendadopoder.com.br,Mulher furta e destrói crucifixo em igreja de Niterói; vídeo,n/a,,Furto e destruição de crucifixo na Igreja Nossa Senhora da Conceição em Niterói,furto-destruicao-crucifixo-igreja-niteroi-2026,furto-destruicao-crucifixo-igreja-niteroi-2026,violencia/crime,"Igreja Nossa Senhora da Conceição, Niterói",2026-01-06,"Uma mulher furtou e destruiu um crucifixo em Niterói, sendo posteriormente localizada pelos agentes do Segurança Presente.",gpt-4o-mini
1598,a-1598,2026-01-13 12:11:03+00:00,Tempo Real RJ,temporealrj.com,Governo estadual do Rio aumenta valor da gratificação para policiais da reserva que atuam em programa de serviço voluntário,positivo,1.0,Aumento da gratificação para policiais da reserva no Programa de Estímulo Operacional (PEOp),aumento-gratificacao-policiais-reserva-peop-2026,aumento-gratificacao-policiais-reserva-peop-2026,gestao/administracao,Rio de Janeiro,2026-01-13,Governo do Rio aumenta gratificação para policiais da reserva que atuam no PEOp.,gpt-4o-mini
1164,a-1164,2026-01-13 12:48:15+00:00,Diario do Rio,diariodorio.com,Mulher é flagrada furtando crucifixo de bronze em igreja tradicional de Niterói,n/a,,Furto de crucifixo na Igreja de Nossa Senhora da Conceição em Niterói,furto-crucifixo-igreja-nossa-senhora-da-conceicao-niteroi-2026,furto-crucifixo-igreja-nossa-senhora-da-conceicao-niteroi-2026,violencia/crime,"Igreja de Nossa Senhora da Conceição, Niterói",2026-01-09,Mulher é flagrada furtando crucifixo em igreja tradicional de Niterói.,gpt-4o-mini
1750,a-1750,2026-01-13 17:05:51+00:00,Agenda do Poder,agendadopoder.com.br,Castro amplia gratificação paga a policiais da reserva; veja os valores,positivo,1.0,Ampliação da gratificação para policiais da reserva no Programa de Estímulo Operacional (PEOp),ampliacao-gratificacao-policiais-reserva-peop-2026,ampliacao-gratificacao-policiais-reserva-peop-2026,gestao/administracao,Rio de Janeiro,2026-01-13,"O governador Cláudio Castro reajusta a gratificação para policiais da reserva que atuam no PEOp, beneficiando a segurança pública.",gpt-4o-mini
1749,a-1749,2026-01-13 17:34:18+00:00,Agenda do Poder,agendadopoder.com.br,Deputado alerta para falhas no plano de segurança e pede reforço da ‘Operação Verão’ na Barra e no Recreio,negativo,-1.0,Pedido de reforço da 'Operação Verão' na Barra e Recreio,reforco-operacao-verao-barra-recreio-2026,reforco-operacao-verao-barra-recreio-2026,gestao/administracao,"Barra da Tijuca e Recreio dos Bandeirantes, Rio de Janeiro",2026-01-13,Deputado solicita reforço da 'Operação Verão' devido a falhas no plano de segurança nas praias.,gpt-4o-mini
1105,a-1105,2026-01-15 08:00:00+00:00,Google News,riodasostras.rj.gov.br,Reunião define ação integrada entre forças de segurança no Sesc Verão - PMRO - Rio das Ostras,positivo,1.0,Ação integrada de segurança no Sesc Verão 2026,acao-integrada-seguranca-sesc-verao-2026,acao-integrada-seguranca-sesc-verao-2026,gestao/administracao,Rio das Ostras,2026-01-13,Reunião define esquema de segurança para o Sesc Verão 2026 com a participação do Segurança Presente.,gpt-4o-mini
1748,a-1748,2026-01-17 12:46:36+00:00,Agenda do Poder,agendadopoder.com.br,Sargento da PM de folga morre baleado ao reagir a assalto em Duque de Caxias,muito negativo,-2.0,Morte do sargento Bruno Dantas de Souza em Duque de Caxias,morte-sargento-bruno-dantas-duque-de-caxias-2026,morte-sargento-bruno-dantas-duque-de-caxias-2026,violencia/crime,Duque de Caxias,2026-01-16,Sargento da PM é morto ao reagir a assalto em Duque de Caxias.,gpt-4o-mini
1057,a-1057,2026-01-18 08:00:00+00:00,Google News,pmsfi.rj.gov.br,São Francisco de Itabapoana vai receber base do programa Segurança Presente - Prefeitura Municipal de São Francisco de Itabapoana,positivo,1.0,Instalação de base do programa Segurança Presente em São Francisco de Itabapoana,instalacao-base-seguranca-presente-sao-francisco-de-itabapoana,instalacao-base-seguranca-presente-sao-francisco-de-itabapoana,inauguracao/expansao,São Francisco de Itabapoana,,São Francisco de Itabapoana receberá uma nova base do programa Segurança Presente.,gpt-4o-mini
1747,a-1747,2026-01-18 09:32:27+00:00,Agenda do Poder,agendadopoder.com.br,Disque Denúncia lança cartaz para identificar assassinos de PM,muito negativo,-2.0,Lançamento de cartaz para identificar assassinos do sargento PM Bruno Dantas de Sousa,lancamento-cartaz-identificacao-assassinos-pm-bruno-dantas-2026,lancamento-cartaz-identificacao-assassinos-pm-bruno-dantas-2026,denuncia/irregularidade,Duque de Caxias,2026-01-18,Disque Denúncia lança cartaz para ajudar a identificar os assassinos do sargento PM Bruno Dantas de Sousa.,gpt-4o-mini
1597,a-1597,2026-01-20 11:00:00+00:00,Tempo Real RJ,temporealrj.com,"Secretaria estadual de Governo contrata a Cesgranrio, sem licitação e por quase R$ 50 milhões, para avaliar o Segurança Presente",negativo,-1.0,Contratação da Fundação Cesgranrio para avaliar o Segurança Presente,contratacao-fundacao-cesgranrio-avaliacao-seguranca-presente-2025,contratacao-fundacao-cesgranrio-avaliacao-seguranca-presente-2025,gestao/administracao,Rio de Janeiro,2025-12-23,Governo do Rio contrata a Cesgranrio por quase R$ 50 milhões para avaliar o programa Segurança Presente sem licitação.,gpt-4o-mini
1596,a-1596,2026-01-25 15:17:07+00:00,Tempo Real RJ,temporealrj.com,Justiça decreta prisão preventiva de homem que agrediu funcionária em tentativa de roubo a sorveteria em Nova Iguaçu,positivo,1.0,Prisão preventiva de homem por tentativa de roubo e agressão em Nova Iguaçu,prisao-preventiva-homem-tentativa-roubo-agressao-nova-iguacu-2026,prisao-preventiva-homem-tentativa-roubo-agressao-nova-iguacu-2026,prisao/apreensao,Nova Iguaçu,2026-01-22,Homem é preso preventivamente após agredir funcionária durante tentativa de roubo a sorveteria.,gpt-4o-mini
1746,a-1746,2026-01-25 17:08:09+00:00,Agenda do Poder,agendadopoder.com.br,Vídeo: homem é preso por série de furtos em Niterói,positivo,1.0,"Prisão de homem por furtos em Icaraí, Niterói",prisao-homem-furtos-icarai-niteroi-2026,prisao-homem-furtos-icarai-niteroi-2026,prisao/apreensao,"Icaraí, Niterói",2026-01-24,Homem é preso por agentes do Segurança Presente após furtos em Icaraí.,gpt-4o-mini
1163,a-1163,2026-01-26 20:57:30+00:00,Diario do Rio,diariodorio.com,Agentes do Segurança Presente são flagrados dormindo em Viatura no Centro do Rio,negativo,-1.0,Agentes do Segurança Presente flagrados dormindo em viatura na Central do Brasil,agentes-seguranca-presente-flagrados-dormindo-viatura-central-do-brasil-2026,agentes-seguranca-presente-flagrados-dormindo-viatura-central-do-brasil-2026,denuncia/irregularidade,Centro do Rio,2026-01-26,Agentes do Segurança Presente foram flagrados dormindo em viatura na Central do Brasil.,gpt-4o-mini
1744,a-1744,2026-01-27 01:30:30+00:00,Agenda do Poder,agendadopoder.com.br,Vídeo mostra policiais do Segurança Presente dormindo em viatura,negativo,-1.0,Policiais do Segurança Presente flagrados dormindo em viatura,policiais-seguranca-presente-dormindo-viatura-2026,policiais-seguranca-presente-dormindo-viatura-2026,denuncia/irregularidade,Centro do Rio,2026-01-26,Vídeo mostra policiais do Segurança Presente dormindo em viatura durante o expediente.,gpt-4o-mini
1864,a-1864,2026-01-27 14:03:50+00:00,Veja Rio,vejario.abril.com.br,Soninho bom: agentes do Segurança Presente são flagrados dormindo em viatura,negativo,-1.0,Agentes do Segurança Presente flagrados dormindo em viatura,agentes-seguranca-presente-flagrados-dormindo-viatura-2026,agentes-seguranca-presente-flagrados-dormindo-viatura-2026,denuncia/irregularidade,"Central do Brasil, Rio de Janeiro",2026-01-26,Agentes do Segurança Presente foram flagrados dormindo em viatura durante o trabalho.,gpt-4o-mini
1033,a-1033,2026-01-28 14:37:38+00:00,Google News,voltaredonda.rj.gov.br,Volta Redonda: visita técnica marca avanço na implantação da 'Operação Segurança Presente' no Retiro - Prefeitura de Volta Redonda,positivo,1.0,"Implantação da Operação Segurança Presente no Retiro, Volta Redonda",implantacao-operacao-seguranca-presente-retiro-2026,implantacao-operacao-seguranca-presente-retiro-2026,inauguracao/expansao,"Volta Redonda, RJ",2026-01-28,"Visita técnica marca avanço na implantação da Operação Segurança Presente no Retiro, visando aumentar a segurança na região.",gpt-4o-mini
1743,a-1743,2026-01-28 15:06:42+00:00,Agenda do Poder,agendadopoder.com.br,Vídeo: Motoboys protestam em frente à prefeitura após morte de entregador em São João de Meriti,negativo,-1.0,Protesto de motoboys em São João de Meriti após assassinato de entregador,protesto-motoboys-sao-joao-meriti-2026,protesto-motoboys-sao-joao-meriti-2026,evento publico/cultural,"São João de Meriti, Rio de Janeiro",2026-01-28,Motoboys protestam em frente à prefeitura após assassinato de entregador em São João de Meriti.,gpt-4o-mini
1742,a-1742,2026-01-29 20:13:10+00:00,Agenda do Poder,agendadopoder.com.br,Posse dos Conselhos de Segurança reúne autoridades e lideranças em Barra Mansa,positivo,1.0,Posse dos Conselhos Comunitários de Segurança em Barra Mansa,posse-conselhos-comunitarios-seguranca-barra-mansa-2026,posse-conselhos-comunitarios-seguranca-barra-mansa-2026,gestao/administracao,Barra Mansa,2026-01-29,Cerimônia marca o início de nova gestão dos Conselhos de Segurança em Barra Mansa.,gpt-4o-mini
1741,a-1741,2026-01-30 15:46:43+00:00,Agenda do Poder,agendadopoder.com.br,Traficante ligado ao Comando Vermelho em MG é preso escondido em Rio das Ostras,positivo,1.0,Prisão de traficante ligado ao Comando Vermelho em Rio das Ostras,prensao-traficante-comando-vermelho-rio-das-ostras-2026,prensao-traficante-comando-vermelho-rio-das-ostras-2026,prisao/apreensao,Rio das Ostras,2026-01-29,Traficante foragido é preso em operação integrada em Rio das Ostras.,gpt-4o-mini
1162,a-1162,2026-02-02 17:27:35+00:00,Diario do Rio,diariodorio.com,Prefeitura de Niterói realizou quase mil abordagens contra motos barulhentas em janeiro,positivo,1.0,Operação de fiscalização contra motos barulhentas em Niterói,operacao-fiscalizacao-motos-barulhentas-niteroi-2026,operacao-fiscalizacao-motos-barulhentas-niteroi-2026,operacao policial,Niterói,2026-01-30,Prefeitura de Niterói realizou quase mil abordagens a motociclistas em janeiro de 2026.,gpt-4o-mini
1161,a-1161,2026-02-05 02:53:47+00:00,Diario do Rio,diariodorio.com,Bairros do Rio sofrem com precarização do programa Segurança Presente nos fins de semana e feriados,negativo,-1.0,Precarização do programa Segurança Presente nos fins de semana e feriados,precarizacao-seguranca-presente-fins-de-semana-2026,precarizacao-seguranca-presente-fins-de-semana-2026,gestao/administracao,Rio de Janeiro,2026-02-04,"Bairros do Rio enfrentam precarização do programa Segurança Presente, com baixa presença policial nos fins de semana.",gpt-4o-mini
1739,a-1739,2026-02-05 10:06:51+00:00,Agenda do Poder,agendadopoder.com.br,Agentes do Segurança Presente salvam bebê engasgada em Nova Iguaçu,positivo,1.0,Salvamento de bebê engasgada em Nova Iguaçu,salvamento-bebe-engasgada-nova-iguacu-2026,salvamento-bebe-engasgada-nova-iguacu-2026,resultado/indicador,Nova Iguaçu,2026-02-04,Agentes do Segurança Presente salvam uma bebê engasgada em Nova Iguaçu.,gpt-4o-mini
1738,a-1738,2026-02-05 11:25:09+00:00,Agenda do Poder,agendadopoder.com.br,Vídeo: Flanelinha é presa por ameaçar motorista na Barra,positivo,1.0,Prisão de flanelinha por extorsão e ameaça na Barra da Tijuca,prisao-flanelinha-extorcao-barra-tijuca-2026,prisao-flanelinha-extorcao-barra-tijuca-2026,prisao/apreensao,"Barra da Tijuca, Rio de Janeiro",2026-02-04,Agentes do Segurança Presente prendem flanelinha por ameaçar motorista na Barra da Tijuca.,gpt-4o-mini
1737,a-1737,2026-02-05 23:48:25+00:00,Agenda do Poder,agendadopoder.com.br,Adolescentes são apreendidos após tentarem roubar cordão de delegada,positivo,1.0,Apreensão de adolescentes após tentativa de roubo de cordão de delegada na Barra da Tijuca,apreensao-adolescentes-tentativa-roubo-delegada-barra-da-tijuca-2026,apreensao-adolescentes-tentativa-roubo-delegada-barra-da-tijuca-2026,prisao/apreensao,"Barra da Tijuca, Rio de Janeiro",2026-02-05,Dois adolescentes foram apreendidos após tentarem roubar o cordão de uma delegada na orla da Barra da Tijuca.,gpt-4o-mini
1160,a-1160,2026-02-06 18:14:17+00:00,Diario do Rio,diariodorio.com,Choque de Ordem Presente intensifica ações de segurança na Gávea e no entorno da Lagoa,positivo,1.0,Operação do Choque de Ordem Presente na Gávea e Lagoa,operacao-choque-de-ordem-presente-gavea-lagoa-2026,operacao-choque-de-ordem-presente-gavea-lagoa-2026,operacao policial,"Gávea e Lagoa Rodrigo de Freitas, Rio de Janeiro",2026-02-05,Operação do Choque de Ordem Presente intensifica segurança na Gávea e Lagoa.,gpt-4o-mini
1159,a-1159,2026-02-06 18:26:46+00:00,Diario do Rio,diariodorio.com,Explosão de roubos na Cinelândia faz Câmara do Rio exigir plano imediato de segurança,negativo,-1.0,Aumento de roubos na Cinelândia e exigência de plano de segurança pela Câmara do Rio,aumento-roubos-cinelândia-2026,aumento-roubos-cinelandia-2026,gestao/administracao,"Cinelândia, Rio de Janeiro",2026-02-11,Câmara do Rio exige plano imediato de segurança devido ao aumento de roubos na Cinelândia.,gpt-4o-mini
1595,a-1595,2026-02-06 18:28:04+00:00,Tempo Real RJ,temporealrj.com,Câmara do Rio pede choque de ordem na Cinelândia devido ao aumento de assaltos,negativo,-1.0,Pedido de choque de ordem na Cinelândia devido ao aumento de assaltos,pedido-choque-ordem-cinelândia-2026,pedido-choque-ordem-cinelandia-2026,gestao/administracao,"Cinelândia, Rio de Janeiro",2026-02-11,Câmara do Rio solicita plano de segurança urgente para a Cinelândia devido ao aumento de assaltos.,gpt-4o-mini
1736,a-1736,2026-02-07 10:26:20+00:00,Agenda do Poder,agendadopoder.com.br,Carnaval de rua do Rio expõe medo e violência em áreas centrais,negativo,-1.0,Relatos de violência e insegurança durante o carnaval de rua no Rio de Janeiro,relatos-violencia-carnaval-2026,relatos-violencia-carnaval-2026,violencia/crime,Rio de Janeiro,2026-02-07,Carnaval de rua no Rio é marcado por relatos de violência e insegurança.,gpt-4o-mini
1158,a-1158,2026-02-07 13:53:13+00:00,Diario do Rio,diariodorio.com,"Pré-carnaval no Rio terá reforço no metrô, trens, barcas, PM e SAMU",positivo,1.0,Reforço do Segurança Presente para o pré-carnaval no Rio de Janeiro,reforco-seguranca-presente-pre-carnaval-2026,reforco-seguranca-presente-pre-carnaval-2026,operacao policial,Rio de Janeiro,2026-02-07,O Governo do Estado do Rio de Janeiro implementa reforço no Segurança Presente para o pré-carnaval.,gpt-4o-mini
1594,a-1594,2026-02-07 20:00:00+00:00,Tempo Real RJ,temporealrj.com,"Moradores denunciam abandono do futuro museu da Polícia Militar, em Niterói",negativo,-1.0,Denúncia de abandono do futuro museu da Polícia Militar em Niterói,denuncia-abandono-museu-policia-militar-niteroi-2026,denuncia-abandono-museu-policia-militar-niteroi-2026,denuncia/irregularidade,Niterói,2026-02-07,"Moradores denunciam abandono do futuro museu da Polícia Militar em Niterói, com aumento da violência na região.",gpt-4o-mini
1735,a-1735,2026-02-09 15:11:14+00:00,Agenda do Poder,agendadopoder.com.br,RJ anuncia esquema com 26 mil agentes para segurança no Carnaval,positivo,1.0,Anúncio do plano de segurança para o Carnaval 2026 no Rio de Janeiro,anuncio-plano-seguranca-carnaval-2026,anuncio-plano-seguranca-carnaval-2026,gestao/administracao,Rio de Janeiro,2026-02-09,Governo do Rio anuncia esquema de segurança com 26 mil agentes para o Carnaval 2026.,gpt-4o-mini
1157,a-1157,2026-02-09 19:40:42+00:00,Diario do Rio,diariodorio.com,"Governo do estado monta operação de Carnaval com 26 mil agentes de segurança, drones e reconhecimento facial",positivo,1.0,Operação de segurança do Carnaval com 26 mil agentes e tecnologia,operacao-seguranca-carnaval-2026,operacao-seguranca-carnaval-2026,operacao policial,Rio de Janeiro,2026-02-09,Governo do estado anuncia operação de segurança para o Carnaval com 26 mil agentes e tecnologia avançada.,gpt-4o-mini
1734,a-1734,2026-02-10 06:43:56+00:00,Agenda do Poder,agendadopoder.com.br,Carnaval 2026: Castro anuncia que vai reforçar segurança na dispersão do Sambódromo,positivo,1.0,Reforço de segurança no Carnaval 2026 no Sambódromo,reforco-seguranca-carnaval-2026-sambodromo,reforco-seguranca-carnaval-2026-sambodromo,operacao policial,Rio de Janeiro,2026-02-10,O governo do Rio de Janeiro anuncia reforço de segurança com 26 mil agentes para o Carnaval 2026.,gpt-4o-mini
1156,a-1156,2026-02-10 12:13:45+00:00,Diario do Rio,diariodorio.com,Carnaval do Rio terá mais de 50 blitz da Lei Seca e fiscalização também dentro do Sambódromo,positivo,1.0,Reforço da segurança no Carnaval de 2026 no Rio de Janeiro,reforco-seguranca-carnaval-2026-rio-de-janeiro,reforco-seguranca-carnaval-2026-rio-de-janeiro,operacao policial,Rio de Janeiro,2026-02-10,O Carnaval de 2026 no Rio terá mais de 50 blitz da Lei Seca e 26 mil agentes de segurança.,gpt-4o-mini
1593,a-1593,2026-02-10 16:09:42+00:00,Tempo Real RJ,temporealrj.com,Lei Seca terá 50 blitzes no carnaval e vai fiscalizar motoristas de carros alegóricos,n/a,,Operação Lei Seca com 50 blitzes durante o carnaval no Rio de Janeiro,operacao-lei-seca-blitzes-carnaval-2026,operacao-lei-seca-blitzes-carnaval-2026,operacao policial,Rio de Janeiro,2026-02-09,"O governo do Rio anunciou 50 blitzes da Operação Lei Seca durante o carnaval, com fiscalização de motoristas de carros alegóricos.",gpt-4o-mini
1063,a-1063,2026-02-11 08:00:00+00:00,Google News,rj.gov.br,Governo do Estado entrega novo espaço para o Segurança Presente na estação Praça XV das barcas - Governo do Estado do Rio de Janeiro,positivo,1.0,Entrega de novo espaço para o Segurança Presente na estação Praça XV das barcas,entrega-novo-espaco-seguranca-presente-praca-xv,entrega-novo-espaco-seguranca-presente-praca-xv,inauguracao/expansao,"Praça XV, Rio de Janeiro",,Governo do Estado entrega novo espaço para o Segurança Presente na estação Praça XV das barcas.,gpt-4o-mini
1863,a-1863,2026-02-11 15:49:27+00:00,Veja Rio,vejario.abril.com.br,Como vai funcionar a Lei Seca durante o Carnaval no Rio,n/a,,Operação Lei Seca durante o Carnaval no Rio,operacao-lei-seca-carnaval-rio-2026,operacao-lei-seca-carnaval-rio-2026,operacao policial,Rio de Janeiro,2026-02-11,O governo do Estado anunciou 50 blitzes da Operação Lei Seca durante o Carnaval no Rio.,gpt-4o-mini
1862,a-1862,2026-02-12 19:20:08+00:00,Veja Rio,vejario.abril.com.br,Insegurança na Cinelândia faz o bar Amarelinho fechar mais cedo,negativo,-1.0,Fechamento antecipado do bar Amarelinho devido à insegurança na Cinelândia,fechamento-antecipado-bar-amarelinho-cinelândia-2026,fechamento-antecipado-bar-amarelinho-cinelandia-2026,violencia/crime,"Cinelândia, Rio de Janeiro",2026-02-12,"O bar Amarelinho fechou duas horas mais cedo devido à violência na Cinelândia, resultando em queda de 50% no faturamento.",gpt-4o-mini
1733,a-1733,2026-02-13 15:46:38+00:00,Agenda do Poder,agendadopoder.com.br,Homem é preso em flagrante tentando furtar bicicleta com alicate de corte no Leblon,positivo,1.0,Prisão de homem por tentativa de furto de bicicleta no Leblon,prensao-homem-tentativa-furto-bicicleta-leblon-2026,prensao-homem-tentativa-furto-bicicleta-leblon-2026,prisao/apreensao,"Leblon, Rio de Janeiro",2026-02-12,Homem é preso em flagrante por agentes do Segurança Presente ao tentar furtar bicicleta no Leblon.,gpt-4o-mini
1155,a-1155,2026-02-14 20:53:18+00:00,Diario do Rio,diariodorio.com,Governo do RJ amplia policiamento e tecnologia para proteger turistas no Carnaval,positivo,1.0,Ampliação do policiamento e tecnologia para o Carnaval 2026 no RJ,ampliacao-policiamento-tecnologia-carnaval-2026,ampliacao-policiamento-tecnologia-carnaval-2026,inauguracao/expansao,Rio de Janeiro,2026,O Governo do RJ mobiliza 26 mil agentes para garantir a segurança dos turistas no Carnaval 2026.,gpt-4o-mini
1833,a-1833,2026-02-15 05:06:48+00:00,Tribuna da Serra,tribunadaserra.com.br,Governo do RJ amplia policiamento e tecnologia para proteger turistas no Carnaval,positivo,1.0,Ampliação do policiamento e tecnologia para o Carnaval 2026 no RJ,ampliacao-policiamento-tecnologia-carnaval-2026,ampliacao-policiamento-tecnologia-carnaval-2026,inauguracao/expansao,Rio de Janeiro,2026-02-10,O Governo do RJ reforçou a segurança para o Carnaval 2026 com 26 mil agentes e tecnologia avançada.,gpt-4o-mini
1154,a-1154,2026-02-15 11:50:28+00:00,Diario do Rio,diariodorio.com,Estado do RJ usa 390 câmeras com reconhecimento facial e mais de 40 torres para reforçar segurança no Carnaval,positivo,1.0,Reforço da segurança no Carnaval com câmeras e torres de observação,reforco-seguranca-carnaval-2026,reforco-seguranca-carnaval-2026,operacao policial,Rio de Janeiro,2026-02-15,O Governo do Estado do RJ reforçou a segurança do Carnaval com 390 câmeras e 40 torres de observação.,gpt-4o-mini
1732,a-1732,2026-02-19 13:02:09+00:00,Agenda do Poder,agendadopoder.com.br,Homem é preso por agredir namorada e danificar celular no Centro,positivo,1.0,Prisão de homem por agressão e dano no Centro do Rio,prensao-agressor-violencia-domestica-centro-rio-2026,prensao-agressor-violencia-domestica-centro-rio-2026,prisao/apreensao,Centro do Rio,2026-02-18,Homem é preso por agredir namorada e danificar celular no Centro do Rio.,gpt-4o-mini
1730,a-1730,2026-02-20 15:35:42+00:00,Agenda do Poder,agendadopoder.com.br,Suspeito de estuprar filhas de 6 e 8 anos é preso em Niterói,positivo,1.0,Prisão de suspeito de estuprar filhas em Niterói,prisao-suspeito-estupro-niteroi-2026,prisao-suspeito-estupro-niteroi-2026,prisao/apreensao,Niterói,2026-02-20,Homem suspeito de estuprar filhas é preso em Niterói por agentes do Segurança Presente.,gpt-4o-mini
1729,a-1729,2026-02-20 16:56:15+00:00,Agenda do Poder,agendadopoder.com.br,PMs trocam tiros com suspeitos de roubo em Copacabana,negativo,-1.0,Tiroteio entre PMs do Segurança Presente e suspeitos de roubo em Copacabana,tiroteio-pms-seguranca-presente-suspeitos-roubo-copacabana-2026,tiroteio-pms-seguranca-presente-suspeitos-roubo-copacabana-2026,operacao policial,"Copacabana, Rio de Janeiro",2026-02-20,"PMs do Segurança Presente trocam tiros com suspeitos de roubo em Copacabana, mas ninguém ficou ferido.",gpt-4o-mini
1153,a-1153,2026-02-21 03:58:56+00:00,Diario do Rio,diariodorio.com,Homem é preso por jogar pedras contra VLT no Centro do Rio,positivo,1.0,Prisão de homem por vandalismo contra VLT no Centro do Rio,prisao-homem-vandalismo-vlt-centro-rio-2026,prisao-homem-vandalismo-vlt-centro-rio-2026,prisao/apreensao,Centro do Rio de Janeiro,2026-02-20,Homem é preso por agentes do Segurança Presente após atirar pedras contra VLT no Centro do Rio.,gpt-4o-mini
1728,a-1728,2026-02-22 11:47:01+00:00,Agenda do Poder,agendadopoder.com.br,Dupla é presa em flagrante com 12 celulares roubados na Uruguaiana,positivo,1.0,Prisão de dupla com 12 celulares roubados na Uruguaiana,prisao-dupla-celulares-roubados-uruguaiana-2026,prisao-dupla-celulares-roubados-uruguaiana-2026,prisao/apreensao,"Rua Uruguaiana, Centro do Rio",2026-02-21,Duas mulheres foram presas em flagrante com 12 celulares roubados na Rua Uruguaiana.,gpt-4o-mini
