evento_id,evento,evento_exemplo,tipo_evento,local,n_artigos,n_classificados,score_medio,media_sentimento,muito_negativo,negativo,neutro,positivo,muito_positivo,n/a,n_positivas,n_negativas,share_positivo,share_negativo,proporcao_positivas,proporcao_negativas,ambiguidade_baixa,ambiguidade_media,ambiguidade_alta,proporcao_ambiguidade_alta,confianca_evento_media,peso_positivo,peso_negativo,titulos_exemplo
continuacao-seguranca-presente-2026,continuacao_seguranca_presente_2026,continuacao_seguranca_presente_2026,anuncio,Rio de Janeiro,1,1,1.0,1.0,0,0,0,1,0,0,1,0,1.0,0.0,1.0,0.0,0,0,0,0.0,0.95,1,0,"Segurança Presente continua, diz Eduardo Paes em vídeo ao rebater fake news"
contratacao-jovens-seguranca-presente-2020,contratacao_jovens_seguranca_presente_2020,contratacao_jovens_seguranca_presente_2020,contratação,"Irajá, Zona Norte do Rio de Janeiro",1,1,1.0,1.0,0,0,0,1,0,0,1,0,1.0,0.0,1.0,0.0,0,0,0,0.0,0.95,1,0,Witzel promete contratação de 2.000 jovens para o programa Segurança Presente
contratacao-jovens-seguranca-presente-2026,contratacao_jovens_seguranca_presente_2026,contratacao_jovens_seguranca_presente_2026,contratação,Rio de Janeiro,1,1,1.0,1.0,0,0,0,1,0,0,1,0,1.0,0.0,1.0,0.0,0,0,0,0.0,0.95,1,0,Governo do estado homologa contratação de mais 1.212 jovens voluntários para o Segurança Presente; investimento pode chegar a R$ 50 milhões
convocacao-taf-seguranca-presente-2025,convocacao_taf_seguranca_presente_2025,convocacao_taf_seguranca_presente_2025,convocação,Rio de Janeiro,1,1,1.0,1.0,0,0,0,1,0,0,1,0,1.0,0.0,1.0,0.0,0,0,0,0.0,0.95,1,0,Candidatos civis do programa Segurança Presente são convocados para realização de TAF - Extra online
crescimento-procura-imoveis-seguranca-presente-2020,crescimento_procura_imoveis_segurança_presente_2020,crescimento_procura_imoveis_segurança_presente_2020,crescimento de procura,"Zona Sul e Tijuca, Rio de Janeiro",1,1,1.0,1.0,0,0,0,1,0,0,1,0,1.0,0.0,1.0,0.0,0,0,0,0.0,0.9,1,0,Cresce a procura por imóveis na Zona Sul e na Tijuca
criacao-base-seguranca-presente-campo-grande,Criacao_base_Seguranca_Presente_Campo_Grande,Criacao_base_Seguranca_Presente_Campo_Grande,Reunião,"Palácio Guanabara, Campo Grande, Rio de Janeiro",1,1,1.0,1.0,0,0,0,1,0,0,1,0,1.0,0.0,1.0,0.0,0,0,0,0.0,0.95,1,0,Campo Grande pode ganhar base do Segurança Presente
criacao-coordenadoria-intolerancias-fobias-sociais,criacao_coordenadoria_intolerancias_fobias_sociais,criacao_coordenadoria_intolerancias_fobias_sociais,anuncio,"Monumento Memorial às Vítimas do Holocausto, Botafogo, Rio de Janeiro",1,1,1.0,1.0,0,0,0,1,0,0,1,0,1.0,0.0,1.0,0.0,0,0,0,0.0,0.95,1,0,Marcelo Queiroz promete criar coordenadoria especial de combate às intolerâncias e fobias sociais
criacao-onibus-seguro,criacao_onibus_seguro,criacao_onibus_seguro,sancao de lei,Rio de Janeiro,1,1,1.0,1.0,0,0,0,1,0,0,1,0,1.0,0.0,1.0,0.0,0,0,0,0.0,0.95,1,0,Cláudio Castro sanciona lei que cria o programa ‘Ônibus Seguro’
criacao-programa-videomonitoramento-rj-2020,criacao_programa_videomonitoramento_rj_2020,criacao_programa_videomonitoramento_rj_2020,aprovação de programa,Rio de Janeiro,1,1,1.0,1.0,0,0,0,1,0,0,1,0,1.0,0.0,1.0,0.0,0,0,0,0.0,0.95,1,0,"Visando aumentar segurança no RJ, Witzel aprova criação do Programa Estadual de Videomonitoramento"
criacao-unita-itaipava-2024,criação_unita_itaipava_2024,criação_unita_itaipava_2024,criação de movimento,"Itaipava, Petrópolis, Rio de Janeiro",1,1,1.0,1.0,0,0,0,1,0,0,1,0,1.0,0.0,1.0,0.0,0,0,0,0.0,0.95,1,0,Itaipava cria movimento para fortalecer segurança na região
cumpula-brics-rio-2025,cumpula_brics_rio_2025,cumpula_brics_rio_2025,evento politico,"Museu de Arte Moderna (MAM), Rio de Janeiro",1,1,1.0,1.0,0,0,0,1,0,0,1,0,1.0,0.0,1.0,0.0,0,0,0,0.0,0.95,1,0,Brics no Rio: 17 mil agentes reforçam segurança para cúpula no MAM
cupula-do-brics-2025,Cúpula do Brics 2025,Cúpula do Brics 2025,evento politico,"Museu de Arte Moderna (MAM), Rio de Janeiro",1,1,1.0,1.0,0,0,0,1,0,0,1,0,1.0,0.0,1.0,0.0,0,0,0,0.0,0.95,1,0,Cúpula do Brics no Rio terá segurança com GLO e mobilização de 17 mil agentes
cupula-do-g20-no-mam-2024,Cúpula do G20 no MAM 2024,Cúpula do G20 no MAM 2024,reforço de segurança,Museu de Arte Moderna do Rio de Janeiro,1,1,1.0,1.0,0,0,0,1,0,0,1,0,1.0,0.0,1.0,0.0,0,0,0,0.0,0.95,1,0,Governo do Estado reforça segurança no primeiro dia da Cúpula do G20 no Museu de Arte Moderna do Rio
curso-porteiros-seguranca-presente,curso_porteiros_seguranca_presente,curso_porteiros_seguranca_presente,curso,Rio de Janeiro,1,1,1.0,1.0,0,0,0,1,0,0,1,0,1.0,0.0,1.0,0.0,0,0,0,0.0,0.95,1,0,"Porteiros podem fazer, de graça, curso com a Operação Segurança Presente"
debate-futuro-centro-rio-acrj-2025,debate_futuro_centro_rio_acrj_2025,debate_futuro_centro_rio_acrj_2025,debate,"Associação Comercial do Rio de Janeiro, Rua da Candelária, Rio de Janeiro",1,1,1.0,1.0,0,0,0,1,0,0,1,0,1.0,0.0,1.0,0.0,0,0,0,0.0,0.95,1,0,Futuro do Centro do Rio é tema de debate entre grandes instituições na Associação Comercial
debate-retorno-policiais-inativos-alerg,debate_retorno_policiais_inativos_alerg,debate_retorno_policiais_inativos_alerg,debate legislativo,Assembleia Legislativa do Rio de Janeiro (Alerj),1,1,1.0,1.0,0,0,0,1,0,0,1,0,1.0,0.0,1.0,0.0,0,0,0,0.0,0.95,1,0,Projeto que reforça programas de segurança com ex-militares começa a ser debatido na Alerj
defesa-operacao-jacarezinho-castro-2021,defesa_operacao_jacarezinho_castro_2021,defesa_operacao_jacarezinho_castro_2021,opinião política,"Jacarezinho, Rio de Janeiro",1,1,1.0,1.0,0,0,0,1,0,0,1,0,1.0,0.0,1.0,0.0,0,0,0,0.0,0.9,1,0,"Quintino: Ao defender a polícia e a pauta da segurança, Claudio Castro cresce"
defesa-participacao-conselho-seguranca-publica-2023,defesa_participacao_conselho_seguranca_publica_2023,defesa_participacao_conselho_seguranca_publica_2023,proposta legislativa,Rio de Janeiro,1,1,1.0,1.0,0,0,0,1,0,0,1,0,1.0,0.0,1.0,0.0,0,0,0,0.0,0.9,1,0,Rodrigo Bacellar defende participação da sociedade no Conselho Estadual de Segurança Pública
defesa-voto-consciente-luiz-lima-2020,defesa_voto_consciente_luiz_lima_2020,defesa_voto_consciente_luiz_lima_2020,discurso político,"Universidade Castelo Branco, Rio de Janeiro",1,1,1.0,1.0,0,0,0,1,0,0,1,0,1.0,0.0,1.0,0.0,0,0,0,0.0,0.95,1,0,Luiz Lima faz defesa do voto consciente
descoberta-laboratorio-maconha-niteroi-2026,descoberta_laboratorio_maconha_niteroi_2026,descoberta_laboratorio_maconha_niteroi_2026,operação policial,"Vila Progresso, Niterói",1,1,1.0,1.0,0,0,0,1,0,0,1,0,1.0,0.0,1.0,0.0,0,0,0,0.0,0.95,1,0,Polícia descobre laboratório com 110 pés de maconha em Niterói; veja o vídeo
desfile-grande-bloco-funk-in-2022,desfile_grande_bloco_funk_in_2022,desfile_grande_bloco_funk_in_2022,Desfile de Carnaval,"Arco do Teles e rua do Mercado, Centro do Rio de Janeiro",1,1,1.0,1.0,0,0,0,1,0,0,1,0,1.0,0.0,1.0,0.0,0,0,0,0.0,0.95,1,0,"Grande Bloco da Funk In desfila hoje no Arco do Teles e rua do Mercado, no Centro"
detencao-fuzil-falso-itaborai-2025,detencao_fuzil_falso_itaborai_2025,detencao_fuzil_falso_itaborai_2025,detenção,"Itaboraí, Região Metropolitana",1,1,1.0,1.0,0,0,0,1,0,0,1,0,1.0,0.0,1.0,0.0,0,0,0,0.0,,1,0,Homem é detido com fuzil falso em Itaboraí
detencao-gabigol-mangue-pesca-ilegal-2026,detencao_gabigol_mangue_pesca_ilegal_2026,detencao_gabigol_mangue_pesca_ilegal_2026,prisão,"Parque Estadual da Serra da Tiririca, Niterói",1,1,1.0,1.0,0,0,0,1,0,0,1,0,1.0,0.0,1.0,0.0,0,0,0,0.0,0.95,1,0,Prefeitura remove 137 construções irregulares em operação em Manguinhos
detencao-influencers-pesca-ilegal-parque-tiririca,detencao_influencers_pesca_ilegal_parque_tiririca,detencao_influencers_pesca_ilegal_parque_tiririca,prisão,"Parque Estadual da Serra da Tiririca, Niterói, RJ",1,1,1.0,1.0,0,0,0,1,0,0,1,0,1.0,0.0,1.0,0.0,0,0,0,0.0,0.95,1,0,Inea detém três “influencers” por pesca ilegal no Parque da Tiririca
detencao-moradora-zona-sul-2022,detencao_moradora_zona_sul_2022,detencao_moradora_zona_sul_2022,prisão,"Flamengo, Zona Sul, Rio de Janeiro",1,1,1.0,1.0,0,0,0,1,0,0,1,0,1.0,0.0,1.0,0.0,0,0,0,0.0,,1,0,Ação detém moradora de rua que agredia e ameaçava pessoas na Zona Sul
detencao-pm-carnaval-2024,detencao_pm_carnaval_2024,detencao_pm_carnaval_2024,prisão,Rio de Janeiro,1,1,1.0,1.0,0,0,0,1,0,0,1,0,1.0,0.0,1.0,0.0,0,0,0,0.0,0.95,1,0,Mais de 270 pessoas foram detidas pela PM durante os primeiros dias de carnaval
detencao-trio-terminal-procopio-ferreira-2025,detencao_trio_terminal_procopio_ferreira_2025,detencao_trio_terminal_procopio_ferreira_2025,prisão,"Terminal Rodoviário Procópio Ferreira, Centro do Rio de Janeiro",1,1,1.0,1.0,0,0,0,1,0,0,1,0,1.0,0.0,1.0,0.0,0,0,0,0.0,,1,0,Golpe do cartão Jaé: trio é flagrado vendendo viagens irregulares no Terminal Procópio Ferreira
devolucao-seguranca-presente-2024,devolucao_seguranca_presente_2024,devolucao_seguranca_presente_2024,anuncio,"Palácio Guanabara, Rio de Janeiro",1,1,1.0,1.0,0,0,0,1,0,0,1,0,1.0,0.0,1.0,0.0,0,0,0,0.0,0.95,1,0,Lei Seca pode ter máquina de cartão para evitar reboque de carro
distribuicao-mascaras-seguranca-presente-2020,distribuicao_mascaras_seguranca_presente_2020,distribuicao_mascaras_seguranca_presente_2020,distribuição,"Rio de Janeiro, Méier, Bangu e Duque de Caxias",1,1,1.0,1.0,0,0,0,1,0,0,1,0,1.0,0.0,1.0,0.0,0,0,0,0.0,0.95,1,0,Operação Segurança Presente e RioSolidario distribuem máscaras de proteção ao Coronavírus
distribuicao-pulseiras-identificacao-carnaval-2019,distribuicao_pulseiras_identificacao_carnaval_2019,distribuicao_pulseiras_identificacao_carnaval_2019,distribuição,Rio de Janeiro,1,1,1.0,1.0,0,0,0,1,0,0,1,0,1.0,0.0,1.0,0.0,0,0,0,0.0,0.95,1,0,Pulseiras de identificação para crianças serão distribuídas no carnaval
doacao-motos-seguranca-presente-niteroi-2025,doacao_motos_seguranca_presente_niteroi_2025,doacao_motos_seguranca_presente_niteroi_2025,doação,"Niterói, RJ",1,1,1.0,1.0,0,0,0,1,0,0,1,0,1.0,0.0,1.0,0.0,0,0,0,0.0,0.95,1,0,Prefeitura de Niterói vai doar 10 motos para o Segurança Presente - Prefeitura Municipal de Niterói
dobro-efetivo-seguranca-presente-2019,dobro_efetivo_seguranca_presente_2019,dobro_efetivo_seguranca_presente_2019,anuncio,Rio de Janeiro,1,1,1.0,1.0,0,0,0,1,0,0,1,0,1.0,0.0,1.0,0.0,0,0,0,0.0,0.95,1,0,Operação Segurança Presente terá efetivo dobrado pelo Governo do Estado
edital-cameras-portateis-rj-2021,edital_cameras_portateis_RJ_2021,edital_cameras_portateis_RJ_2021,licitação,"Rio de Janeiro, RJ",1,1,1.0,1.0,0,0,0,1,0,0,1,0,1.0,0.0,1.0,0.0,0,0,0,0.0,0.95,1,0,Governo do RJ publica edital para implantação de câmeras portáteis
edital-seguranca-presente-rj-2025,edital_seguranca_presente_rj_2025,edital_seguranca_presente_rj_2025,Concurso,Rio de Janeiro,1,1,1.0,1.0,0,0,0,1,0,0,1,0,1.0,0.0,1.0,0.0,0,0,0,0.0,0.95,1,0,"Segurança Presente RJ: saiu edital com 2,2 mil vagas! - Estratégia Concursos"
edital-selecao-extensionistas-uerj-2021,edital_selecao_extensionistas_uerj_2021,edital_selecao_extensionistas_uerj_2021,Concurso,"Universidade do Estado do Rio de Janeiro (UERJ), Rio de Janeiro",1,1,1.0,1.0,0,0,0,1,0,0,1,0,1.0,0.0,1.0,0.0,0,0,0,0.0,0.9,1,0,Segurança presente Archives - UERJ - Universidade do Estado do Rio de Janeiro - uerj.br
edital-vagas-seguranca-presente-2025,edital_vagas_seguranca_presente_2025,edital_vagas_seguranca_presente_2025,concurso,Rio de Janeiro,1,1,1.0,1.0,0,0,0,1,0,0,1,0,1.0,0.0,1.0,0.0,0,0,0,0.0,0.95,1,0,Segurança Presente RJ: saiu edital para 2.212 vagas. Níveis médio e superior! - Degrau Cultural
eleicao-capitao-nelson-prefeito-sao-goncalo,eleicao_capitao_nelson_prefeito_sao_goncalo,eleicao_capitao_nelson_prefeito_sao_goncalo,eleição,São Gonçalo,1,1,1.0,1.0,0,0,0,1,0,0,1,0,1.0,0.0,1.0,0.0,0,0,0,0.0,0.95,1,0,Capitão Nelson é eleito prefeito de São Gonçalo
elogios-operacao-tijuca-presente,elogios_operacao_tijuca_presente,elogios_operacao_tijuca_presente,elogio,"Tijuca, Rio de Janeiro",1,1,1.0,1.0,0,0,0,1,0,0,1,0,1.0,0.0,1.0,0.0,0,0,0,0.0,0.9,1,0,Moradores elogiam trabalho da Operação Tijuca Presente
encontro-250-desaparecidos-seguranca-presente,encontro_250_desaparecidos_seguranca_presente,encontro_250_desaparecidos_seguranca_presente,localização de desaparecidos,Rio de Janeiro,1,1,1.0,1.0,0,0,0,1,0,0,1,0,1.0,0.0,1.0,0.0,0,0,0,0.0,0.95,1,0,Segurança Presente já encontrou 250 pessoas desaparecidas
encontro-seguranca-publica-2021,encontro_seguranca_publica_2021,encontro_seguranca_publica_2021,encontro,Rio de Janeiro,1,1,1.0,1.0,0,0,0,1,0,0,1,0,1.0,0.0,1.0,0.0,0,0,0,0.0,0.95,1,0,Claudio Castro defende integração na segurança pública
entrega-bicicletas-seguranca-presente-rio-2025,Entrega_bicicletas_Seguranca_Presente_Rio_2025,Entrega_bicicletas_Seguranca_Presente_Rio_2025,Entrega,Zona Sul do Rio de Janeiro,1,1,1.0,1.0,0,0,0,1,0,0,1,0,1.0,0.0,1.0,0.0,0,0,0,0.0,0.95,1,0,Zona Sul do Rio terá policiamento com bicicletas elétricas; veja os bairros atendidos
entrega-bicicletas-viaturas-seguranca-presente-2026,entrega_bicicletas_viaturas_seguranca_presente_2026,entrega_bicicletas_viaturas_seguranca_presente_2026,entrega,"Palácio Guanabara, Rio de Janeiro",1,1,1.0,1.0,0,0,0,1,0,0,1,0,1.0,0.0,1.0,0.0,0,0,0,0.0,0.95,1,0,Governo do RJ entrega 337 bicicletas elétricas e 140 viaturas ao Segurança Presente
entrega-bikes-e-viaturas-seguranca-presente-2026,entrega_bikes_e_viaturas_seguranca_presente_2026,entrega_bikes_e_viaturas_seguranca_presente_2026,entrega,"Palácio Guanabara, Rio de Janeiro",1,1,1.0,1.0,0,0,0,1,0,0,1,0,1.0,0.0,1.0,0.0,0,0,0,0.0,0.95,1,0,"Segurança Presente ganha 337 bikes elétricas e 140 novas viaturas, anuncia governo do RJ"
entrega-motocicletas-niteroi-presente-2021,entrega_motocicletas_niteroi_presente_2021,entrega_motocicletas_niteroi_presente_2021,entrega,"Palácio Guanabara, Niterói",1,1,1.0,1.0,0,0,0,1,0,0,1,0,1.0,0.0,1.0,0.0,0,0,0,0.0,0.95,1,0,Claudio Castro entrega mais 20 motocicletas para o Niterói Presente
entrega-novo-espaco-seguranca-presente-praca-xv-2026,entrega_novo_espaco_seguranca_presente_praça_xv_2026,entrega_novo_espaco_seguranca_presente_praça_xv_2026,inauguracao,"estação Praça XV das barcas, Rio de Janeiro",1,1,1.0,1.0,0,0,0,1,0,0,1,0,1.0,0.0,1.0,0.0,0,0,0,0.0,0.95,1,0,Governo do Estado entrega novo espaço para o Segurança Presente na estação Praça XV das barcas - Governo do Estado do Rio de Janeiro
entrega-veiculos-seguranca-presente-2022,entrega_veiculos_seguranca_presente_2022,entrega_veiculos_seguranca_presente_2022,entrega,"Monumento aos Pracinhas, Aterro do Flamengo, Rio de Janeiro",1,1,1.0,1.0,0,0,0,1,0,0,1,0,1.0,0.0,1.0,0.0,0,0,0,0.0,0.95,1,0,Governo do Estado aumenta frota de veículos dos programas Segurança Presente e Lei Seca
esquema-seguranca-eleicoes-2024,esquema_seguranca_eleicoes_2024,esquema_seguranca_eleicoes_2024,esquema de segurança,Rio de Janeiro,1,1,1.0,1.0,0,0,0,1,0,0,1,0,1.0,0.0,1.0,0.0,0,0,0,0.0,0.95,1,0,"Esquema de segurança garante tranquilidade nas eleições municipais, afirma Governo do Estado"
esquema-seguranca-eleicoes-rj-2024,esquema_seguranca_eleicoes_RJ_2024,esquema_seguranca_eleicoes_RJ_2024,Operação de segurança,Rio de Janeiro,1,1,1.0,1.0,0,0,0,1,0,0,1,0,1.0,0.0,1.0,0.0,0,0,0,0.0,0.95,1,0,Polícia do RJ vai monitorar redes sociais e usar drones e câmeras em esquema de segurança para as eleições
esquema-seguranca-reveillon-2025,esquema_seguranca_reveillon_2025,esquema_seguranca_reveillon_2025,esquema de segurança,Rio de Janeiro,1,1,1.0,1.0,0,0,0,1,0,0,1,0,1.0,0.0,1.0,0.0,0,0,0,0.0,0.95,1,0,Governo divulga esquema de segurança para o réveillon 2025
expansao-seguranca-presente-retiro,expansao_seguranca_presente_retiro,expansao_seguranca_presente_retiro,expansão,"bairro Retiro, Volta Redonda, RJ",1,1,1.0,1.0,0,0,0,1,0,0,1,0,1.0,0.0,1.0,0.0,0,0,0,0.0,0.95,1,0,Volta Redonda: Neto viabiliza expansão do programa Segurança Presente para o bairro Retiro - Prefeitura de Volta Redonda
expansao-seguranca-presente-tijuca-2021,expansao_seguranca_presente_tijuca_2021,expansao_seguranca_presente_tijuca_2021,inauguracao,"Largo da Segunda-Feira, Tijuca, Rio de Janeiro",1,1,1.0,1.0,0,0,0,1,0,0,1,0,1.0,0.0,1.0,0.0,0,0,0,0.0,0.95,1,0,Tijuca ganha expansão do Programa Segurança Presente para o Largo da Segunda-Feira
festival-cinema-miguel-pereira-2024,festival_cinema_miguel_pereira_2024,festival_cinema_miguel_pereira_2024,festival,"Miguel Pereira, Rio de Janeiro",1,1,1.0,1.0,0,0,0,1,0,0,1,0,1.0,0.0,1.0,0.0,0,0,0,0.0,0.95,1,0,"Polo turístico, Miguel Pereira poderá ter festival de cinema inspirado em Gramado"
fiscalizacao-motos-icarai-2025,fiscalizacao_motos_icarai_2025,fiscalizacao_motos_icarai_2025,fiscalização,"Icaraí, Niterói",1,1,1.0,1.0,0,0,0,1,0,0,1,0,1.0,0.0,1.0,0.0,0,0,0,0.0,0.95,1,0,Prefeitura de Niterói fiscaliza mais de 200 motos em operação contra ruído em Icaraí
formacao-policiais-rj-2021,formacao_policiais_rj_2021,formacao_policiais_rj_2021,formação,"Centro de Formação e Aperfeiçoamento de Praças (CFAP), Jardim Sulacap, Rio de Janeiro",1,1,1.0,1.0,0,0,0,1,0,0,1,0,1.0,0.0,1.0,0.0,0,0,0,0.0,0.95,1,0,RJ terá reforço na segurança de 475 policiais militares
formatura-agentes-drones-seguranca-presente-2024,formatura_agentes_drones_segurança_presente_2024,formatura_agentes_drones_segurança_presente_2024,formatura,Rio de Janeiro,1,1,1.0,1.0,0,0,0,1,0,0,1,0,1.0,0.0,1.0,0.0,0,0,0,0.0,0.95,1,0,RJ vai reforçar o Segurança Presente com drones nas 40 bases
formatura-agentes-seguranca-presente-2026,formatura_agentes_seguranca_presente_2026,formatura_agentes_seguranca_presente_2026,formatura,Rio de Janeiro,1,1,1.0,1.0,0,0,0,1,0,0,1,0,1.0,0.0,1.0,0.0,0,0,0,0.0,0.95,1,0,Cláudio Castro forma mais de mil agentes do Segurança Presente e lança cinco novos projetos no Rio
formatura-seguranca-presente-2026,formatura_seguranca_presente_2026,formatura_seguranca_presente_2026,formatura,Rio de Janeiro,1,1,1.0,1.0,0,0,0,1,0,0,1,0,1.0,0.0,1.0,0.0,0,0,0,0.0,0.95,1,0,"Mais de 1,2 mil agentes civis do Segurança Presente se formam na próxima semana"
freedom-festival-itaguai-2026,freedom_festival_itaguai_2026,freedom_festival_itaguai_2026,festival,"Parque Municipal de Itaguaí, Rio de Janeiro",1,1,1.0,1.0,0,0,0,1,0,0,1,0,1.0,0.0,1.0,0.0,0,0,0,0.0,1.0,1,0,Freedom Festival reúne milhares de pessoas em noite histórica de fé em Itaguaí
fundo-estado-seguranca-presente-2020,Fundo_Estado_Seguranca_Presente_2020,Fundo_Estado_Seguranca_Presente_2020,sancao de lei,Rio de Janeiro,1,1,1.0,1.0,0,0,0,1,0,0,1,0,1.0,0.0,1.0,0.0,0,0,0,0.0,0.95,1,0,"‘Menina dos olhos’ de Witzel, Operação Segurança Presente ganhará Fundo Estadual de Fomento"
gabinete-itinerante-subprefeitura-centro-2023,gabinete_itinerante_subprefeitura_centro_2023,gabinete_itinerante_subprefeitura_centro_2023,Ação pública,"Largo da Carioca, Centro do Rio de Janeiro",1,1,1.0,1.0,0,0,0,1,0,0,1,0,1.0,0.0,1.0,0.0,0,0,0,0.0,0.95,1,0,Subprefeitura do Centro inicia Gabinete Itinerante no Largo da Carioca
hotel-acolhedor-pernoites,hotel_acolhedor_pernoites,hotel_acolhedor_pernoites,programa social,Rio de Janeiro,1,1,1.0,1.0,0,0,0,1,0,0,1,0,1.0,0.0,1.0,0.0,0,0,0,0.0,0.95,1,0,Hotel Acolhedor do Rio tem mais de 1.800 pernoites em 45 dias
implantacao-bases-seguranca-presente-japeri-2021,implantacao_bases_seguranca_presente_japeri_2021,implantacao_bases_seguranca_presente_japeri_2021,inauguracao,"Japeri, RJ",1,1,1.0,1.0,0,0,0,1,0,0,1,0,1.0,0.0,1.0,0.0,0,0,0,0.0,0.95,1,0,Japeri ganha duas bases do programa Segurança Presente - Prefeitura Municipal de Japeri
implantacao-cameras-portateis-copacabana-2021,implantacao_cameras_portateis_copacabana_2021,implantacao_cameras_portateis_copacabana_2021,Implantação,"Copacabana, Rio de Janeiro",1,1,1.0,1.0,0,0,0,1,0,0,1,0,1.0,0.0,1.0,0.0,0,0,0,0.0,0.95,1,0,Câmeras portáteis começam a ser usadas por policiais militares em Copacabana
implantacao-centro-presente,implantacao_centro_presente,implantacao_centro_presente,implantacao,"Zona Portuária, Rio de Janeiro",1,1,1.0,1.0,0,0,0,1,0,0,1,0,1.0,0.0,1.0,0.0,0,0,0,0.0,0.95,1,0,O que é a operação Centro Presente
implantacao-seguranca-presente-penha-2021,implantacao_seguranca_presente_penha_2021,implantacao_seguranca_presente_penha_2021,projeto de lei,"Mercado São Sebastião, Penha, Rio de Janeiro",1,1,1.0,1.0,0,0,0,1,0,0,1,0,1.0,0.0,1.0,0.0,0,0,0,0.0,0.95,1,0,"Deputado quer Segurança Presente no Mercado São Sebastião, Penha"
implantacao-seguranca-presente-retiro-volta-redonda,implantacao_seguranca_presente_retiro_volta_redonda,implantacao_seguranca_presente_retiro_volta_redonda,inauguracao,"Retiro, Volta Redonda, RJ",1,1,1.0,1.0,0,0,0,1,0,0,1,0,1.0,0.0,1.0,0.0,0,0,0,0.0,,1,0,Volta Redonda: visita técnica marca avanço na implantação da 'Operação Segurança Presente' no Retiro - Prefeitura de Volta Redonda
implantacao-seguranca-presente-rj-2022,implantacao_seguranca_presente_rj_2022,implantacao_seguranca_presente_rj_2022,opinião,Rio de Janeiro,1,1,1.0,1.0,0,0,0,1,0,0,1,0,1.0,0.0,1.0,0.0,0,0,0,0.0,0.9,1,0,Alexandre Knoploch: Aproximar a polícia do cidadão para combater o crime
implementacao-bairro-seguro-santa-teresa,implementacao_bairro_seguro_santa_teresa,implementacao_bairro_seguro_santa_teresa,implementacao,"Santa Teresa, Rio de Janeiro",1,1,1.0,1.0,0,0,0,1,0,0,1,0,1.0,0.0,1.0,0.0,0,0,0,0.0,0.95,1,0,Projeto ‘Bairro Seguro’ pode ser implementado em Santa Teresa
implementacao-novas-bases-seguranca-presente-rj-2026,implementacao_novas_bases_seguranca_presente_rj_2026,implementacao_novas_bases_seguranca_presente_rj_2026,expansão de programa de segurança,Rio de Janeiro,1,1,1.0,1.0,0,0,0,1,0,0,1,0,1.0,0.0,1.0,0.0,0,0,0,0.0,0.95,1,0,Segurança Presente: Governo do RJ planeja implementar quase 30 novas bases em 2026
implementacao-seguranca-presente-jacarepagua-maracana,implementacao_seguranca_presente_jacarepagua_maracana,implementacao_seguranca_presente_jacarepagua_maracana,projeto,"Jacarepaguá e Maracanã, Rio de Janeiro",1,1,1.0,1.0,0,0,0,1,0,0,1,0,1.0,0.0,1.0,0.0,0,0,0,0.0,0.9,1,0,Jacarepaguá e Maracanã podem ter Segurança Presente
implementacao-seguranca-presente-vias-expressas-rio-2019,implementacao_seguranca_presente_vias_expressas_rio_2019,implementacao_seguranca_presente_vias_expressas_rio_2019,implementacao,Vias Expressas do Rio de Janeiro,1,1,1.0,1.0,0,0,0,1,0,0,1,0,1.0,0.0,1.0,0.0,0,0,0,0.0,0.95,1,0,Vias Expressas do Rio ganharão seu “Segurança Presente”
implementacao-seguranca-presente-volta-redonda-2019,implementacao_seguranca_presente_volta_redonda_2019,implementacao_seguranca_presente_volta_redonda_2019,implementacao,"Volta Redonda, RJ",1,1,1.0,1.0,0,0,0,1,0,0,1,0,1.0,0.0,1.0,0.0,0,0,0,0.0,0.95,1,0,Prefeitura acerta implementação do programa estadual operação Segurança Presente - Prefeitura de Volta Redonda
implementacao-seguranca-presente-volta-redonda-barra-do-pirai-2022,implementacao_seguranca_presente_volta_redonda_barra_do_pirai_2022,implementacao_seguranca_presente_volta_redonda_barra_do_pirai_2022,implementacao,"Volta Redonda e Barra do Piraí, Rio de Janeiro",1,1,1.0,1.0,0,0,0,1,0,0,1,0,1.0,0.0,1.0,0.0,0,0,0,0.0,0.95,1,0,"Volta Redonda e Barra do Piraí, no Médio Paraíba, ganham Segurança Presente do governo do Rio"
inauguracao-4-companhia-pm-sao-goncalo,inauguracao_4_companhia_pm_sao_goncalo,inauguracao_4_companhia_pm_sao_goncalo,inauguração,"São Gonçalo, RJ",1,1,1.0,1.0,0,0,0,1,0,0,1,0,1.0,0.0,1.0,0.0,0,0,0,0.0,0.95,1,0,Cláudio Castro inaugura 4ª Companhia Destacada da PM em São Gonçalo
inauguracao-bairro-seguro-santa-teresa-2021,inauguracao_bairro_seguro_santa_teresa_2021,inauguracao_bairro_seguro_santa_teresa_2021,inauguracao,"Santa Teresa, Rio de Janeiro",1,1,1.0,1.0,0,0,0,1,0,0,1,0,1.0,0.0,1.0,0.0,0,0,0,0.0,0.95,1,0,Projeto ‘Bairro Seguro’ é implementado em Santa Teresa
inauguracao-base-seguranca-presente-austin,inauguracao_base_seguranca_presente_austin,inauguracao_base_seguranca_presente_austin,inauguração,"Austin, Nova Iguaçu, Rio de Janeiro",1,1,1.0,1.0,0,0,0,1,0,0,1,0,1.0,0.0,1.0,0.0,0,0,0,0.0,0.95,1,0,Segurança Presente inaugura base em Austin - Prefeitura de Nova Iguaçu
inauguracao-base-seguranca-presente-belford-roxo-2026,inauguracao_base_seguranca_presente_belford_roxo_2026,inauguracao_base_seguranca_presente_belford_roxo_2026,inauguracao,"Praça Eliaquim Batista, Belford Roxo",1,1,1.0,1.0,0,0,0,1,0,0,1,0,1.0,0.0,1.0,0.0,0,0,0,0.0,0.95,1,0,"Praça Eliaquim Batista, no Centro, ganhará nova base da Operação Segurança Presente - Prefeitura de Belford Roxo"
inauguracao-base-seguranca-presente-buzios,inauguracao_base_seguranca_presente_buzios,inauguracao_base_seguranca_presente_buzios,inauguração,"Armação dos Búzios, Rio de Janeiro",1,1,1.0,1.0,0,0,0,1,0,0,1,0,1.0,0.0,1.0,0.0,0,0,0,0.0,1.0,1,0,Búzios ganha primeira base do Segurança Presente e vira a 62ª unidade do programa no estado
inauguracao-base-seguranca-presente-campo-grande,inauguracao_base_seguranca_presente_campo_grande,inauguracao_base_seguranca_presente_campo_grande,inauguração,"Campo Grande, Rio de Janeiro",1,1,1.0,1.0,0,0,0,1,0,0,1,0,1.0,0.0,1.0,0.0,0,0,0,0.0,0.95,1,0,Campo Grande ganha base do Segurança Presente após iniciativa de Márcio Gualberto
inauguracao-base-seguranca-presente-campo-grande-2024,inauguracao_base_seguranca_presente_campo_grande_2024,inauguracao_base_seguranca_presente_campo_grande_2024,inauguração,"Campo Grande, Rio de Janeiro",1,1,1.0,1.0,0,0,0,1,0,0,1,0,1.0,0.0,1.0,0.0,0,0,0,0.0,1.0,1,0,Campo Grande ganha base do Segurança Presente e reforça a segurança na Zona Oeste
inauguracao-base-seguranca-presente-campos,inauguracao_base_seguranca_presente_campos,inauguracao_base_seguranca_presente_campos,inauguracao,"Campos dos Goytacazes, Rio de Janeiro",1,1,1.0,1.0,0,0,0,1,0,0,1,0,1.0,0.0,1.0,0.0,0,0,0,0.0,0.95,1,0,Governo do Estado anuncia mais investimentos para cidades do interior atingidas pelas chuvas
