recordKey,jsonIndex,id,articleId,publishedAt,publishedDisplay,sourceName,sourceHost,title,storyId,storyTitle,targetKeys,label,sentiment_score,grau_ambiguidade,reason,evidencia_sentimento,evento,evento_chave,evento_id,tipo_evento,local,data_evento,descricao_curta,evidencia_evento,model,month
a-1041,863,a-1041,1041,2016-05-31 07:00:00+00:00,31/05/2016 07:00 UTC,Google News,rio.rj.gov.br,Prefeitura da Cidade do Rio de Janeiro - Prefeitura da Cidade do Rio de Janeiro,757,Prefeitura da Cidade do Rio de Janeiro - Prefeitura da Cidade do Rio de Janeiro,seguranca_presente,positivo,1.0,baixo,A notícia destaca a operação Centro Presente como um reforço positivo no patrulhamento e segurança na região central do Rio de Janeiro.,A experiência positiva das operações realizadas nas outras regiões da cidade foi fundamental para a implantação do Centro Presente.,Início da Operação Centro Presente com 528 agentes de segurança,inicio-operacao-centro-presente-2016,inicio-operacao-centro-presente-2016,operacao policial,Centro do Rio de Janeiro,2016-07-02,A Operação Centro Presente será lançada com 528 agentes para reforçar a segurança no Centro do Rio.,A operação contará com a presença ostensiva de 528 agentes de segurança e terá investimento anual de R$ 47 milhões.,gpt-4o-mini,2016-05
a-1571,862,a-1571,1571,2016-08-29 14:52:53+00:00,29/08/2016 14:52 UTC,Diario do Rio,diariodorio.com,O que é a operação Centro Presente,1098,O que é a operação Centro Presente,crime; seguranca,positivo,1.0,baixo,"A notícia destaca a atuação efetiva da operação Centro Presente, com um número significativo de prisões e ações de acolhimento.",Os agentes da Operação Segurança Presente haviam efetuado 2.076 prisões...,Implantação da operação Centro Presente no Centro do Rio,implantacao-operacao-centro-presente-centro-rio-2016,implantacao-operacao-centro-presente-centro-rio-2016,operacao policial,Centro do Rio de Janeiro,2016-07-04,A operação Centro Presente foi implantada no Centro do Rio para aumentar a segurança na região.,A operação chegou ao centro no dia quatro de julho deste ano.,gpt-4o-mini,2016-08
a-1570,853,a-1570,1570,2018-12-24 13:50:05+00:00,24/12/2018 13:50 UTC,Diario do Rio,diariodorio.com,Tijuca Presente começa em 3 de Janeiro,1089,Laranjeiras Presente começa a circular no bairro nesta sexta,patrulhamento; seguranca; seguranca_presente,positivo,1.0,baixo,A notícia destaca o início do projeto Segurança Presente na Tijuca como uma ação positiva para a segurança do bairro.,Quem vê um bairro antes e depois do Segurança Presente sabe a diferença que ele faz.,Início do projeto Segurança Presente na Tijuca,inicio-seguranca-presente-tijuca-2019,inicio-seguranca-presente-tijuca-2019,inauguracao/expansao,"Tijuca, Rio de Janeiro",2019-01-03,"O projeto Segurança Presente começa na Tijuca em 3 de janeiro de 2019, com 30 agentes de segurança.",A partir de 3 de Janeiro de 2019 tem início o projeto Segurança Presente no bairro.,gpt-4o-mini,2018-12
a-1569,861,a-1569,1569,2019-01-18 16:14:10+00:00,18/01/2019 16:14 UTC,Diario do Rio,diariodorio.com,Vias Expressas do Rio ganharão seu “Segurança Presente”,1097,Vias Expressas do Rio ganharão seu “Segurança Presente”,crime; policiamento; seguranca; seguranca_presente,positivo,1.0,baixo,"A notícia menciona a criação de um programa semelhante ao Segurança Presente, o que é visto como uma medida positiva para a segurança nas Vias Expressas.",Esperamos que faça o mesmo sucesso que o 'Segurança Presente'.,Criação do programa Segurança Presente nas Vias Expressas do Rio de Janeiro,criacao-seguranca-presente-vias-expressas-rio-2019,criacao-seguranca-presente-vias-expressas-rio-2019,inauguracao/expansao,Rio de Janeiro,2019-01-18,O governador Wilson Witzel anuncia a criação do programa Segurança Presente nas Vias Expressas do Rio.,"O projeto que deve começar na Linha Vermelha deve ter viaturas, efetivo e planejamento.",gpt-4o-mini,2019-01
a-1060,315,a-1060,1060,2019-01-21 08:00:00+00:00,21/01/2019 08:00 UTC,Google News,oglobo.globo.com,Programa Segurança Presente cresce custeado por comerciantes,758,Falta de policiais no programa Segurança Presente deixa bairros do Rio com bases esvaziadas nos fins de semana,programa_seguranca_presente; seguranca; seguranca_presente,positivo,1.0,baixo,"A notícia destaca a expansão do programa Segurança Presente com apoio de comerciantes, o que é visto como um avanço positivo.",O governo já tem propostas de associações comerciais e empresas para levar a iniciativa para o Maracanã e para Jacarepaguá.,"Expansão do programa Segurança Presente para Jacarepaguá, Maracanã e Baixada Fluminense",expansao-seguranca-presente-jacarepagua-maracana-baixada-2019,expansao-seguranca-presente-jacarepagua-maracana-baixada-2019,inauguracao/expansao,Rio de Janeiro,2019-01-21,O programa Segurança Presente será expandido para novas áreas com financiamento de comerciantes.,O secretário promete que vai levar em consideração a mancha criminal para expandir o programa.,gpt-4o-mini,2019-01
a-1568,376,a-1568,1568,2019-01-21 11:53:36+00:00,21/01/2019 11:53 UTC,Diario do Rio,diariodorio.com,Jacarepaguá e Maracanã podem ter Segurança Presente,885,Largo da Lapa ganha base fixa 24h do Segurança Presente,crime; seguranca; seguranca_presente,positivo,1.0,baixo,A notícia destaca o sucesso do programa em outras regiões e o interesse em expandi-lo para Jacarepaguá e Maracanã.,"O projeto, que é um sucesso nas regiões em que está, reduziu em 81% dos crimes registrados na 14ª DP (Leblon).",Possível implementação do programa Segurança Presente em Jacarepaguá e Maracanã,implementacao-seguranca-presente-jacarepagua-maracana-2019,implementacao-seguranca-presente-jacarepagua-maracana-2019,inauguracao/expansao,"Jacarepaguá e Maracanã, Rio de Janeiro",2019-01-21,"O programa Segurança Presente pode ser expandido para Jacarepaguá e Maracanã, com apoio local.",A Associação Comercial e Industrial de Jacarepaguá bancaria o programa no bairro.,gpt-4o-mini,2019-01
a-1567,860,a-1567,1567,2019-01-21 12:12:43+00:00,21/01/2019 12:12 UTC,Diario do Rio,diariodorio.com,Prefeitura fará ações de ordenamento urbano no Centro,1096,Prefeitura fará ações de ordenamento urbano no Centro,programa_seguranca_presente; seguranca; seguranca_presente,positivo,1.0,baixo,A notícia destaca a ação de ordenamento urbano em parceria com o programa Segurança Presente como um motivo de comemoração.,A operação é descrita como motivo de comemoração.,Ação de ordenamento urbano no Centro do Rio em parceria com o Segurança Presente,acao-ordenamento-urbano-centro-rio-2019,acao-ordenamento-urbano-centro-rio-2019,gestao/administracao,Centro do Rio de Janeiro,2019-01-21,Prefeitura inicia ação de ordenamento urbano no Centro do Rio em parceria com o Segurança Presente.,"A Prefeitura do Rio iniciou hoje, 21/1, pela manhã ação de ordenamento urbano no Centro do Rio, em conjunto com o programa Segurança Presente.",gpt-4o-mini,2019-01
a-1566,361,a-1566,1566,2019-01-30 16:18:39+00:00,30/01/2019 16:18 UTC,Diario do Rio,diariodorio.com,Segurança Presente vai reforçar policiamento no Carnaval,816,"Segurança Presente ganha reforço de verão na Zona Sul e no Centro, com 495 agentes por dia",policiamento; seguranca; seguranca_presente,positivo,1.0,baixo,"A notícia destaca o reforço do policiamento durante o Carnaval, o que é uma ação positiva do programa Segurança Presente.",A iniciativa prevê a contribuição de todos os agentes que atuam nas ações já a partir do período pré-carnavalesco.,Reforço do policiamento do Segurança Presente no Carnaval,reforco-policamento-seguranca-presente-carnaval-2019,reforco-policamento-seguranca-presente-carnaval-2019,inauguracao/expansao,Rio de Janeiro,2019-02-01,Segurança Presente reforça policiamento para o Carnaval no Rio de Janeiro.,O coordenador das Operações Segurança Presente firmou uma parceria para reforçar a segurança de foliões.,gpt-4o-mini,2019-01
a-1565,859,a-1565,1565,2019-02-21 21:37:03+00:00,21/02/2019 21:37 UTC,Diario do Rio,diariodorio.com,Pulseiras de identificação para crianças serão distribuídas no carnaval,1095,Pulseiras de identificação para crianças serão distribuídas no carnaval,seguranca; seguranca_presente,positivo,1.0,baixo,"A notícia destaca a distribuição de pulseiras de identificação para crianças durante o Carnaval, promovendo segurança e prevenção de perdas.","A campanha visa facilitar a localização de crianças em caso de incidentes, promovendo segurança no Carnaval.",Distribuição de pulseiras de identificação para crianças no Carnaval,distribuicao-pulseiras-identificacao-carnaval-2019,distribuicao-pulseiras-identificacao-carnaval-2019,evento publico/cultural,Rio de Janeiro,2019-02-22,Serão distribuídas 390 mil pulseiras de identificação para crianças durante o Carnaval no Rio de Janeiro.,As assistentes sociais das operações Segurança Presente ficarão responsáveis pela distribuição nas bases do Centro.,gpt-4o-mini,2019-02
a-1564,858,a-1564,1564,2019-06-28 19:57:04+00:00,28/06/2019 19:57 UTC,Diario do Rio,diariodorio.com,"‘Sou situação, mas posso virar oposição’, diz Witzel a Paulo Guedes",1094,"‘Sou situação, mas posso virar oposição’, diz Witzel a Paulo Guedes",seguranca_presente,positivo,1.0,baixo,A notícia destaca a expansão do programa Segurança Presente e o apoio do governador a iniciativas de segurança.,"Witzel anunciou novos pontos do programa Segurança Presente, que conta com policiamento ostensivo.",Expansão do programa Segurança Presente para novos bairros e cidades,expansao-seguranca-presente-bangu-barra-botafogo-laranjeiras-vila-isabel-2019,expansao-seguranca-presente-bangu-barra-botafogo-laranjeiras-vila-isabel-2019,inauguracao/expansao,Rio de Janeiro,2019-06-28,O governador Witzel anunciou a expansão do programa Segurança Presente para novos bairros e cidades.,"O 'Segurança Presente' chegará aos seguintes bairros: Bangu, Barra da Tijuca, Botafogo, Laranjeiras e Vila Isabel.",gpt-4o-mini,2019-06
a-1563,488,a-1563,1563,2019-07-08 21:52:50+00:00,08/07/2019 21:52 UTC,Diario do Rio,diariodorio.com,Segurança Presente chega a novas áreas a partir de agosto,763,"Segurança Presente chega à Barra sexta-feira, ao custo de R$ 18 milhões por ano",programa_seguranca_presente; seguranca; seguranca_presente,positivo,1.0,baixo,"A notícia destaca a expansão do programa Segurança Presente para novas áreas, o que é uma ação positiva do governo.","As regiões do Grajaú, Catete e Largo do Machado foram incluídas no planejamento de expansão do programa Segurança Presente.","Expansão do programa Segurança Presente para Grajaú, Catete e Largo do Machado",expansao-seguranca-presente-grajau-catete-largo-do-machado-2019,expansao-seguranca-presente-grajau-catete-largo-do-machado-2019,inauguracao/expansao,Rio de Janeiro,2019-08-01,O programa Segurança Presente será expandido para novas áreas no Rio de Janeiro a partir de agosto de 2019.,O governo começa a implementar um monitoramento via satélite para fiscalizar as equipes do programa.,gpt-4o-mini,2019-07
a-1562,832,a-1562,1562,2019-07-16 18:10:15+00:00,16/07/2019 18:10 UTC,Diario do Rio,diariodorio.com,Segurança Presente será expandido para 5 bairros do Rio,1065,Operação Niterói Presente será ampliada para a Região Oceânica,programa_seguranca_presente; seguranca; seguranca_presente,positivo,1.0,baixo,"A notícia destaca a expansão do programa Segurança Presente, o que é uma ação positiva para a segurança pública.",O programa Segurança Presente tem um novo cronograma de expansão para o estado do Rio.,Expansão do programa Segurança Presente para 5 bairros do Rio,expansao-seguranca-presente-bairros-rio-2019,expansao-seguranca-presente-bairros-rio-2019,inauguracao/expansao,Rio de Janeiro,2019-08-01,O programa Segurança Presente será expandido para 5 bairros do Rio de Janeiro a partir de agosto de 2019.,"Os municípios de Nova Iguaçu e Caxias, e os bairros de Laranjeiras, Barra da Tijuca, Botafogo, Austin, Miguel Couto, Vila Isabel e Bangu, são os próximos a receber o reforço na segurança.",gpt-4o-mini,2019-07
a-1107,101,a-1107,1107,2019-07-24 07:00:00+00:00,24/07/2019 07:00 UTC,Google News,oglobo.globo.com,Segurança Presente diminui número de PMs em unidades para expandir áreas,774,Segurança Presente diminui número de PMs em unidades para expandir áreas,operacao_seguranca_presente; seguranca; seguranca_presente,negativo,-1.0,baixo,A notícia critica a redução do efetivo policial e a forma como a expansão do programa está sendo conduzida.,A gestão estadual optou por diminuir efetivos que já existiam para dar a impressão de crescimento.,Redução do efetivo policial no programa Segurança Presente para expansão de áreas,reducao-efetivo-seguranca-presente-2019,reducao-efetivo-seguranca-presente-2019,gestao/administracao,Rio de Janeiro,2019,O programa Segurança Presente reduz o número de PMs em unidades para expandir áreas de atuação.,"O governo anunciou que irá para mais nove áreas no segundo semestre, incluindo a Baixada Fluminense.",gpt-4o-mini,2019-07
a-1561,31,a-1561,1561,2019-07-25 20:55:25+00:00,25/07/2019 20:55 UTC,Diario do Rio,diariodorio.com,Operação Segurança Presente terá efetivo dobrado pelo Governo do Estado,778,Segurança Presente terá transição entre Secretaria de Governo e Polícia Militar,operacao_seguranca_presente; seguranca; seguranca_presente,positivo,1.0,baixo,"A notícia destaca o aumento do efetivo e investimentos no programa, indicando uma ação positiva do governo.","O governador anunciou que a Operação Segurança Presente terá seu efetivo dobrado, passando de mil para 2 mil agentes.",Dobro do efetivo da Operação Segurança Presente anunciado pelo governador do Rio de Janeiro,dobro-efetivo-operacao-seguranca-presente-2019,dobro-efetivo-operacao-seguranca-presente-2019,inauguracao/expansao,Rio de Janeiro,2019-07-22,Governo do Rio anuncia aumento do efetivo da Operação Segurança Presente para 2 mil agentes.,O estado vai destinar R$ 50 milhões para as expansões que irão acontecer ainda em 2019.,gpt-4o-mini,2019-07
a-1560,857,a-1560,1560,2019-07-30 17:57:49+00:00,30/07/2019 17:57 UTC,Diario do Rio,diariodorio.com,Wilson Witzel apostando em Pedro Fernandes para prefeito em 2020,1093,Wilson Witzel apostando em Pedro Fernandes para prefeito em 2020,seguranca_presente,n/a,,alto,"A notícia não avalia diretamente o programa Segurança Presente, focando na candidatura de Pedro Fernandes.",,Apoio de Wilson Witzel à candidatura de Pedro Fernandes para prefeito do Rio em 2020,apoio-wilson-witzel-pedro-fernandes-prefeito-2020,apoio-wilson-witzel-pedro-fernandes-prefeito-2020,outro,Rio de Janeiro,2020,Wilson Witzel demonstra apoio à candidatura de Pedro Fernandes para a prefeitura do Rio em 2020.,Witzel está apostando forte no nome de Pedro Fernandes para ser seu candidato a prefeito do Rio em 2020.,gpt-4o-mini,2019-07
a-1559,774,a-1559,1559,2019-07-31 14:52:33+00:00,31/07/2019 14:52 UTC,Diario do Rio,diariodorio.com,Segurança Presente apreende mais de 50 objetos cortantes em 1 dia de operação,1012,Segurança Presente de Campos levou 38 suspeitos à delegacia na primeira semana de atuação,operacao_seguranca_presente; seguranca; seguranca_presente,positivo,1.0,baixo,"A operação resultou na apreensão de objetos cortantes e na prisão de um homem, evidenciando a efetividade do programa.","Policiais militares e agentes civis recolheram 55 objetos cortantes, entre eles 36 facas, e um homem foi preso em flagrante.",Apreensão de 55 objetos cortantes e prisão em operação do Segurança Presente,apreensao-objetos-cortantes-seguranca-presente-2019,apreensao-objetos-cortantes-seguranca-presente-2019,operacao policial,Rio de Janeiro,2019-07-30,Operação do Segurança Presente apreende 55 objetos cortantes e resulta em uma prisão no Rio de Janeiro.,"Nesta terça-feira, 30/07, policiais militares e agentes civis das bases da Operação Segurança Presente recolheram 55 objetos cortantes.",gpt-4o-mini,2019-07
a-1558,856,a-1558,1558,2019-07-31 21:32:45+00:00,31/07/2019 21:32 UTC,Diario do Rio,diariodorio.com,"Editorial: Witzel está certo, usuário de droga na rua é para internar ou prender",1092,"Editorial: Witzel está certo, usuário de droga na rua é para internar ou prender",crime; seguranca; seguranca_presente,positivo,1.0,baixo,"A notícia apoia a ação do governador Witzel em relação à internação de usuários de drogas, considerando-a necessária e correta.","A ação de Witzel está corretíssima, não podemos permanecer abandonados à própria sorte.",Apreensão de armas brancas pela Segurança Presente e proposta de internação de usuários de drogas no Rio de Janeiro,apreensao-armas-brancas-seguranca-presente-internacao-usuarios-drogas-2019,apreensao-armas-brancas-seguranca-presente-internacao-usuarios-drogas-2019,operacao policial,Rio de Janeiro,2019-07-31,A Segurança Presente apreendeu armas brancas e discute a internação de usuários de drogas no Rio.,Segurança Presente apreendendo dezenas de armas brancas – muitas delas com moradores de rua.,gpt-4o-mini,2019-07
a-1557,855,a-1557,1557,2019-08-11 01:09:01+00:00,11/08/2019 01:09 UTC,Diario do Rio,diariodorio.com,Governo do Estado quer o controle da ordem urbana em praias e praças do Rio,1091,Governo do Estado quer o controle da ordem urbana em praias e praças do Rio,seguranca_presente,negativo,-1.0,baixo,"A notícia retrata a tentativa do governo de assumir funções da Prefeitura, evidenciando problemas com camelôs e moradores de rua.",Aumento do problema de ambulantes e moradores de rua pela cidade é mencionado.,Controle da ordem urbana em praias e praças do Rio,controle-ordem-urbana-praias-pracas-rio-2019,controle-ordem-urbana-praias-pracas-rio-2019,gestao/administracao,Rio de Janeiro,2019-08-10,Governo do Estado do Rio busca controlar a ordem urbana em praias e praças.,O projeto visa coibir a utilização irregular do espaço público por camelôs e moradores de rua.,gpt-4o-mini,2019-08
a-1030,192,a-1030,1030,2019-08-16 07:00:00+00:00,16/08/2019 07:00 UTC,Google News,novaiguacu.rj.gov.br,Inaugurada base do Segurança Presente em Nova Iguaçu - Prefeitura de Nova Iguaçu,746,Segurança Presente inaugura sua segunda base em Nova Iguaçu - Prefeitura de Nova Iguaçu,programa_seguranca_presente; seguranca; seguranca_presente,positivo,1.0,baixo,A inauguração da base do Segurança Presente é vista como um avanço na segurança e expectativa positiva para a população.,O prefeito afirmou que o programa vai aumentar a sensação de segurança para a população.,Inauguração da base do Segurança Presente em Nova Iguaçu,inauguracao-base-seguranca-presente-nova-iguacu-2019,inauguracao-base-seguranca-presente-nova-iguacu-2019,inauguracao/expansao,Nova Iguaçu,2019-08-16,"Foi inaugurada a primeira base do programa Segurança Presente na Baixada Fluminense, em Nova Iguaçu.","A unidade foi instalada na Praça Rui Barbosa, no Centro da cidade, por meio de uma parceria da Prefeitura e o Governo estadual.",gpt-4o-mini,2019-08
a-1085,487,a-1085,1085,2019-09-05 07:00:00+00:00,05/09/2019 07:00 UTC,Google News,oglobo.globo.com,Laranjeiras terá Segurança Presente a partir desta sexta-feira,763,"Segurança Presente chega à Barra sexta-feira, ao custo de R$ 18 milhões por ano",patrulhamento; programa_seguranca_presente; seguranca; seguranca_presente,positivo,1.0,baixo,"A notícia destaca a chegada do programa Segurança Presente em Laranjeiras como uma resposta a pedidos da comunidade, com expectativa de melhoria na segurança.","O presidente da AMAL comemorou a chegada do programa, afirmando que o bairro todo se mobilizou.",Chegada do programa Segurança Presente em Laranjeiras,chegada-seguranca-presente-laranjeiras-2019,chegada-seguranca-presente-laranjeiras-2019,inauguracao/expansao,"Laranjeiras, Rio de Janeiro",2019-09-06,O programa Segurança Presente será implementado em Laranjeiras com patrulhamento comunitário.,"O programa Segurança Presente chegará às ruas do bairro das Laranjeiras, com 69 agentes patrulhando.",gpt-4o-mini,2019-09
a-1556,854,a-1556,1556,2019-09-05 19:32:33+00:00,05/09/2019 19:32 UTC,Diario do Rio,diariodorio.com,Rodrigo Pimentel: Estado de Turismo para salvar o Rio,1090,Rodrigo Pimentel: Estado de Turismo para salvar o Rio,seguranca,negativo,-1.0,baixo,"A notícia critica a insegurança no Rio de Janeiro, mencionando assassinatos de turistas e sugerindo a necessidade de zonas de segurança máxima.",O Rio de Janeiro se tornou a cidade onde turista morre esfaqueado em áreas turísticas.,Proposta de zonas verdes para segurança de turistas no Rio de Janeiro,proposta-zonas-verdes-seguranca-turistas-rio-2019,proposta-zonas-verdes-seguranca-turistas-rio-2019,gestao/administracao,Rio de Janeiro,2019-09-05,Rodrigo Pimentel propõe zonas verdes para garantir segurança a turistas no Rio de Janeiro.,"A primeira zona verde seria toda a extensão da orla, indo do Leme ao Leblon.",gpt-4o-mini,2019-09
a-1555,852,a-1555,1555,2019-09-05 22:07:48+00:00,05/09/2019 22:07 UTC,Diario do Rio,diariodorio.com,Laranjeiras Presente começa a circular no bairro nesta sexta,1089,Laranjeiras Presente começa a circular no bairro nesta sexta,patrulhamento; programa_seguranca_presente; seguranca; seguranca_presente,positivo,1.0,baixo,"A notícia destaca a chegada do programa Segurança Presente ao bairro de Laranjeiras, com investimento significativo e aumento do patrulhamento.","Serão investidos R$ 8,3 milhões por ano no projeto – custo mensal de R$692 mil reais.",Inauguração do programa Segurança Presente em Laranjeiras,inauguracao-seguranca-presente-laranjeiras-2019,inauguracao-seguranca-presente-laranjeiras-2019,inauguracao/expansao,"Laranjeiras, Rio de Janeiro",2019-09-06,O programa Segurança Presente inicia operações em Laranjeiras com 69 agentes.,"O programa Segurança Presente chega ao bairro de Laranjeiras, na Zona Sul do Rio de Janeiro, nesta sexta-feira, 06/09.",gpt-4o-mini,2019-09
a-1554,851,a-1554,1554,2019-09-12 19:55:58+00:00,12/09/2019 19:55 UTC,Diario do Rio,diariodorio.com,Abrigos da Prefeitura têm vagas para apenas 15% das pessoas em situação de rua,1088,Abrigos da Prefeitura têm vagas para apenas 15% das pessoas em situação de rua,seguranca_presente,negativo,-1.0,baixo,"A notícia destaca a insuficiência de vagas em abrigos e cortes no orçamento, refletindo falhas na política pública de assistência.",O orçamento total da Secretaria Municipal de Assistência Social sofreu cortes nos últimos anos.,Insuficiência de vagas em abrigos para pessoas em situação de rua no Rio de Janeiro,insuficiencia-vagas-abrigos-situacao-rua-rio-2019,insuficiencia-vagas-abrigos-situacao-rua-rio-2019,gestao/administracao,Rio de Janeiro,2019,"A Prefeitura do Rio tem vagas para apenas 15% das pessoas em situação de rua, com cortes no orçamento da assistência social.","A Prefeitura do Rio conta com 63 abrigos, que só têm 2,3 mil vagas.",gpt-4o-mini,2019-09
a-1553,850,a-1553,1553,2019-09-19 17:37:48+00:00,19/09/2019 17:37 UTC,Diario do Rio,diariodorio.com,"Felipe Lucena: Põe a mão na cabecinha, Witzel",1087,"Felipe Lucena: Põe a mão na cabecinha, Witzel",seguranca,negativo,-1.0,baixo,"A notícia critica a política de segurança do governo Witzel, destacando a repetição de erros e a violência nas favelas.","A situação piora, pois essa rotina de tiroteios deixa a vida dos moradores ainda mais difícil.",Críticas à política de segurança de Witzel nas favelas do Rio de Janeiro,criticas-politica-seguranca-witzel-favelas-2019,criticas-politica-seguranca-witzel-favelas-2019,denuncia/irregularidade,Rio de Janeiro,2019,A política de segurança de Witzel é criticada por sua ineficácia e pela violência nas favelas.,A política de segurança do governo Wilson Witzel nas favelas do Rio de Janeiro não é muito diferente do que já é feito há décadas.,gpt-4o-mini,2019-09
a-1552,486,a-1552,1552,2019-09-20 17:15:53+00:00,20/09/2019 17:15 UTC,Diario do Rio,diariodorio.com,Segurança Presente começa em Bangu nesta sexta-feira,763,"Segurança Presente chega à Barra sexta-feira, ao custo de R$ 18 milhões por ano",operacao_seguranca_presente; seguranca; seguranca_presente,positivo,1.0,baixo,"A notícia destaca a inauguração da operação, que visa promover segurança e ações sociais em Bangu.",A operação contará com 60 agentes fixos e visa promover ações de segurança pública.,Inauguração da Operação Segurança Presente em Bangu,inauguracao-operacao-seguranca-presente-bangu-2019,inauguracao-operacao-seguranca-presente-bangu-2019,inauguracao/expansao,"Bangu, Rio de Janeiro",2019-09-20,"Foi inaugurada a Operação Segurança Presente em Bangu, com 60 agentes atuando no centro comercial.","Foi inaugurada nesta sexta-feira (20/09), a Operação Segurança Presente em Bangu.",gpt-4o-mini,2019-09
a-1551,375,a-1551,1551,2019-10-05 17:04:34+00:00,05/10/2019 17:04 UTC,Diario do Rio,diariodorio.com,Botafogo ganha Segurança Presente,885,Largo da Lapa ganha base fixa 24h do Segurança Presente,operacao_seguranca_presente; seguranca; seguranca_presente,positivo,1.0,baixo,A notícia retrata a inauguração do programa Segurança Presente em Botafogo como um avanço na segurança da região.,A inauguração desta sexta-feira fecha um importante cinturão de segurança na cidade do Rio de Janeiro.,Inauguração do programa Segurança Presente em Botafogo,inauguracao-seguranca-presente-botafogo-2019,inauguracao-seguranca-presente-botafogo-2019,inauguracao/expansao,"Botafogo, Rio de Janeiro",2019-10-04,Botafogo recebe a operação Segurança Presente com 58 agentes para reforçar a segurança no bairro.,"A operação foi instalada nesta sexta-feira, 4/10, com uma base na Praça Nelson Mandela.",gpt-4o-mini,2019-10
